;Alessandro Belchior Administração de Imóveis Ltda;412;412;CASA para alugar na cidade de FORTALEZA-CE;Casa com 03 quartos sendo 01 suíte com armários, living, sala de jantar, cozinha, DCE, quintal, 05 vagas.;2022-09-23T22:24:48.342Z;2023-04-27T21:42:30.212Z;;4;60130460;Rua Carvalho Júnior;Tauape;332;1;3;3;;;;STANDARD;HOME;;RESIDENTIAL;;-3.75882;RENTAL;Bairros;False;Casa para alugar em;;2.800;0;-38.512962;False;USED;GOOGLE;UNIT;0;False;L7669;True;Ceará;ROOFTOP;False;;Alugar;BR;STREET;61169048-ace0-3daa-e89c-3048088b59b5;/imovel/aluguel-casa-3-quartos-tauape-fortaleza-ce-412m2-id-2581754245/;GRUPOZAP;2581754245;RENTAL;ALL;Fortaleza;VALID_STREET;mês;;2.800;casas;False;False;False;False;False;False;False;False;False;False;False;False;False;False;False;False;False
;NOVA ERA CONSULTORIA IMOBILIARIA EIRELI - ME;120;120;Casa com 3 dormitórios para alugar, 120 m² por 1.400,00/mês - Bonsucesso - Fortaleza/CE;Casa duplex no bairro João xxiii<br>Imóvel amplo com 3 quartos, 2 banheiros, sala, cozinha, sala de jantar, dispensa, quintal e garagem de ate 3 carros.<br><br>Próximo de farmácias, escola, supermercados, terminais de onibus, shopping e restaurantes. -;2023-04-13T02:08:21.908Z;2023-05-02T22:19:56.415Z;;0;60520485;;Bonsucesso;;1;2;3;;;;STANDARD;HOME;;RESIDENTIAL;BACKYARD;;RENTAL;Bairros;False;Casa para alugar em;01007-J-CE;1.400;0;;False;USED;;UNIT;0;False;CA0063;True;Ceará;ROOFTOP;False;;Alugar;BR;STREET;87f4429d-98f8-9729-db36-cf3e2db221cc;/imovel/aluguel-casa-3-quartos-com-quintal-bonsucesso-fortaleza-ce-120m2-id-2625853344/;GRUPOZAP;2625853344;RENTAL;NEIGHBORHOOD;Fortaleza;VALID_STREET;mês;;1.400;casas;False;False;True;False;False;False;False;False;False;False;False;False;False;False;False;False;False
;JORDÃO IMOBILIÁRIA LTDA ME;90;90;OTIMA CASA COM 03 QUARTOS, QUINTAL, FORRADA E GRADEADA. PROXIMO A CASA DO PORTUGUES NA AV. JOAO PES;1 BANHEIRO SOCIAL,COZINHA, 3 QUARTO(S), AGUA & ENEL: CAGECE E ENEL,SALA DE JANTAR, 1 VARANDA,CORREDOR,FACHADA PRINCIPAL;2023-03-27T15:46:44.583Z;2023-05-04T18:38:02.842Z;;0;60426112;Rua José Façanha;Damas;141;0;1;3;;;;STANDARD;HOME;;RESIDENTIAL;;-3.755516;RENTAL;Bairros;False;Casa para alugar em;01249-J-CE;900;0;-38.553726;False;USED;GOOGLE;UNIT;0;False;L3924;True;Ceará;ROOFTOP;False;;Alugar;BR;STREET;50dd7e05-300c-bec5-f892-2e274d3cf2d4;/imovel/aluguel-casa-3-quartos-damas-fortaleza-ce-90m2-id-2621156659/;GRUPOZAP;2621156659;RENTAL;ALL;Fortaleza;VALID_STREET;mês;;900;casas;False;False;False;False;False;False;False;False;False;False;False;False;False;False;False;False;False
premium;FIDUCIAL CAFRE NEGOCIOS IMOBILIARIOS LTDA - EPP;144;144;PAQUE MANIBURA - CASA NÃO RESIDENCIAL RUA PROFESSOR CARLOS LOBO, 250. Aproximadamente 253m² Frente;PAQUE MANIBURA - CASA NÃO RESIDENCIAL RUA PROFESSOR CARLOS LOBO, 250. Aproximadamente 253m² Frente 7,67m x 32m fundos, área constr. 144m², com ampla garagem, deck, sala, 3 dormitorios sendo 1 suite, banheiro social, cozinha, quintal, escritório, area deserviço, deck com banheiro.;2023-01-05T20:27:19.866Z;2023-05-03T23:31:22.076Z;;0;60821740;Rua Professor Carlos Lobo;Parque Manibura;250;1;3;3;;;;PREMIUM;HOME;;RESIDENTIAL;;-3.795376;RENTAL;Bairros;False;Casa para alugar em;00725-J-CE;3.500;0;-38.482949;False;USED;GOOGLE;UNIT;0;False;L17792;True;Ceará;ROOFTOP;False;;Alugar;BR;STREET;fab5bcf2-cb3b-1791-18aa-d3f1d7bc85a7;/imovel/aluguel-casa-3-quartos-parque-manibura-fortaleza-ce-144m2-id-2603699165/;GRUPOZAP;2603699165;RENTAL;ALL;Fortaleza;VALID_STREET;mês;;3.500;casas;False;False;False;False;False;False;False;False;False;False;False;False;False;False;False;False;False
;7Cantos;195;195;Casa, Guararapes, 3 Quartos;"O canto que te oferece conforto, ar puro e ruas arborizadas, além de estar próximo a grandes supermercados, hospitais e faculdades, você encontra aqui na 7Cantos. A casa está localizada no bairro Guararapes, considerado um dos bairros mais prósperos de Fortaleza, o Guararapes tem uma infraestrutura digna de bairro nobre. O imóvel tem espaço suficiente para acomodar confortavelmente as pessoas que você ama; são 195m² de área construída, muito bem distribuídos em 3 quartos, sendo 2 deles suítes, sala ampla, 3 banheiros, cozinha, área de serviço, quintal e 3 vagas na garagem. A casa ainda possui um jardim verdinho na área externa. Não perca a oportunidade de viver em um ambiente que lhe oferece toda comodidade e tranquilidade de um bairro residencial. Ligue para a 7Cantos e agende sua visita!";2022-12-15T18:47:22.989Z;2022-12-15T18:47:25.052Z;;3;60810015;Rua Manuel Firmino Sampaio;Guararapes;258;2;3;3;;280;;STANDARD;HOME;;RESIDENTIAL;SERVICE_AREA|INTERCOM|BACKYARD|PETS_ALLOWED;-3.760656;RENTAL;Bairros;False;Casa para alugar em;10138-J-CE;4.500;0;-38.484943;False;USED;GOOGLE;UNIT;0;False;34089;True;Ceará;ROOFTOP;False;;Alugar;BR;STREET;6aea1890-014e-941d-06e4-90db3afb4a90;/imovel/aluguel-casa-3-quartos-com-area-de-servico-guararapes-fortaleza-ce-195m2-id-2599688802/;GRUPOZAP;2599688802;RENTAL;ALL;Fortaleza;VALID_STREET;mês;;4.500;casas;False;False;True;False;False;False;False;False;False;False;False;False;False;False;False;False;False
;A PREDIAL IMÓVEIS LTDA EPP;76;76;Casa para aluguel, 3 quartos, 2 suítes, 1 vaga, Novo Mondubim - Fortaleza/CE;Agora você pode morar nesta maravilhosa casa próximo ao Centerbox Supermercados. <br><br>- sala<br>- cozinha<br>- 03 quartos (02 suítes sendo 01 suíte reversível)<br>- banheiro<br>- varanda<br>- quintal<br><br>Não perca a oportunidade de está localizado próximo a Academia Smart Fit - Vila Peri, rede de ensino, restaurantes, farmárcias, entre outros. <br><br>Agende uma visita e confira agora mesmo.;2022-06-14T08:04:58.428Z;2023-05-05T12:25:31.135Z;0;1;60764035;Rua Eulina Jucá;Novo Mondubim;;2;2;3;;76;;STANDARD;HOME;;RESIDENTIAL;BALCONY|GARAGE|KITCHEN|BACKYARD|SERVICE_AREA;;RENTAL;Bairros;False;Casa para alugar em;00051-J-CE;1.800;0;;False;USED;;UNIT;0;False;7485;True;Ceará;RANGE_INTERPOLATED;False;;Alugar;BR;STREET;fc5712e9-fa43-5098-d352-567837858f50;/imovel/aluguel-casa-3-quartos-com-varanda-novo-mondubim-fortaleza-ce-76m2-id-2566672858/;GRUPOZAP;2566672858;RENTAL;STREET;Fortaleza;VALID_STREET;mês;;1.800;casas;False;False;True;False;False;False;False;False;False;False;False;False;False;False;False;False;False
rankingSuperPremium;MEGA VENDA DE IMOVEIS,SERVIÇOS E CONDOMINIO LTDA;210;228;Casa com 3 dormitórios para alugar, 209 m² por 2.400,00/ano - São Bento - Fortaleza/CE;Localizado a 3 quadras da Av. Edson Magalhães, próximo ao Estádio Moreirão, Colégio Joaquim Barroso Neto, Nova Fitness Academia, Farmácia Droga Life, com fácil acesso a Av. Dr. Mendel Steinbruch, Banco Santander e outras conveniências.<br>Casa duplex dispõe de 130 m², sala ampla, cozinha, 3 suíte, closet, varanda, banheiro social, área de serviço, deck com churrasqueira e 3 vagas de garagem.<br>Venha conhecer! -;2022-06-24T08:34:38.447Z;2023-05-03T03:38:46.023Z;;3;60875600;;São Bento;;3;4;3;;;;SUPER_PREMIUM;HOME;;RESIDENTIAL;BARBECUE_GRILL|KITCHEN|BACKYARD|SERVICE_AREA;;RENTAL;Bairros;False;Casa para alugar em;;2.400;0;;False;USED;;UNIT;0;False;CA0927;True;Ceará;RANGE_INTERPOLATED;False;;Alugar;BR;STREET;d799ba7e-10ff-931b-817a-f11141492529;/imovel/aluguel-casa-3-quartos-com-churrasqueira-sao-bento-fortaleza-ce-210m2-id-2568649910/;GRUPOZAP;2568649910;RENTAL;NEIGHBORHOOD;Fortaleza;VALID_STREET;mês;;2.400;casas;False;False;True;False;True;False;False;False;False;False;False;False;False;False;False;False;False
;MEGA ADMINISTRACAO DE IMOVEIS LTDA - ME;139;139;Casa com 3 quartos para alugar no Prefeito José Walter - Fortaleza/CE;Casa projetada dispõe de 139,02m², sala, varanda, cozinha americana, 3 quartos sendo 2 suítes e 1 reversível e área de serviço.<br>Localizada a 3 quadras da Av. João de Araújo Lima, próximo ao Laboratório Clementino Fraga, Creche Escola Bela Infância, Loja de Tintas Auto Tintas, Clínica Veterinária Vethouse, Canadá Supermercados, Academia top fit e outras conveniências.<br>Venha conhecer! -;2022-11-05T08:40:30.797Z;2023-04-15T00:07:27.632Z;;0;60750060;Avenida G;Prefeito José Walter;641;2;2;3;;313;;STANDARD;HOME;;RESIDENTIAL;KITCHEN|SERVICE_AREA;-3.837651;RENTAL;Bairros;False;Casa para alugar em;00452-J-CE;1.800;0;-38.560193;False;USED;GOOGLE;UNIT;0;False;CA1212;True;Ceará;ROOFTOP;False;;Alugar;BR;STREET;ad5fe715-fe78-13a9-9ad1-0d1926f4b893;/imovel/aluguel-casa-3-quartos-com-cozinha-prefeito-jose-walter-fortaleza-ce-139m2-id-2590247506/;GRUPOZAP;2590247506;RENTAL;ALL;Fortaleza;VALID_STREET;mês;;1.800;casas;False;False;False;False;False;False;False;False;False;False;False;False;False;False;False;False;False
;FIDUCIAL CAFRE NEGOCIOS IMOBILIARIOS LTDA - EPP;102;102;LAGOA REDONDA - Rua Nelson Coelho, 745 - Aproximadamente 102M², com sala, 3 dormitorios sendo 2 suit;LAGOA REDONDA - Rua Nelson Coelho, 745 - Aproximadamente 102M², com sala, 3 dormitorios sendo 2 suites, cozinha, area de serviço, proximo ao Baratão Curió.;2023-01-04T20:25:55.535Z;2023-01-19T20:51:10.800Z;;0;60831410;Rua Nelson Coelho;Lagoa Redonda;745;2;4;3;;;;STANDARD;HOME;;RESIDENTIAL;;-3.831376;RENTAL;Bairros;False;Casa para alugar em;00725-J-CE;1.300;0;-38.46193;False;USED;GOOGLE;UNIT;0;False;L17745;True;Ceará;ROOFTOP;False;;Alugar;BR;STREET;fab5bcf2-cb3b-1791-18aa-d3f1d7bc85a7;/imovel/aluguel-casa-3-quartos-lagoa-redonda-fortaleza-ce-102m2-id-2603464592/;GRUPOZAP;2603464592;RENTAL;ALL;Fortaleza;VALID_STREET;mês;;1.300;casas;False;False;False;False;False;False;False;False;False;False;False;False;False;False;False;False;False
;MEGA ADMINISTRACAO DE IMOVEIS LTDA - ME;189;189;Casa com 3 quartos para alugar no bairro Tauape - Fortaleza/CE;Localizado próximo a Av. Pontes Vieira, Colégio Shalom, Oficina Auto Quality, Delegacia de Polícia Civil | 4° Distrito Policial, Farmácia Drogasil, Supermercado Super Portugal, Clínica Veterinária Pet Derme, Auto Peças Padre Cícero, Academia Cearense de Odontologia e outras conveniências.<br>Casa com energia solar dispõe de 189m², sala, cozinha, lavanderia, lavabo, 3 quartos sendo 1 suíte, 2 banheiros e 1 vaga de garagem.<br>Venha conhecer! -;2022-07-01T02:43:15.689Z;2023-04-15T00:07:24.715Z;;1;60130371;Rua Monsenhor Salazar;Tauape;2041;1;3;3;;625;;STANDARD;HOME;;RESIDENTIAL;AIR_CONDITIONING|KITCHEN|LAUNDRY;-3.755219;RENTAL;Bairros;False;Casa para alugar em;00452-J-CE;2.200;0;-38.506084;False;USED;GOOGLE;UNIT;0;False;CA1010;True;Ceará;RANGE_INTERPOLATED;False;;Alugar;BR;STREET;ad5fe715-fe78-13a9-9ad1-0d1926f4b893;/imovel/aluguel-casa-3-quartos-com-ar-condicionado-tauape-fortaleza-ce-189m2-id-2569578395/;GRUPOZAP;2569578395;RENTAL;ALL;Fortaleza;VALID_STREET;mês;;2.200;casas;False;False;False;False;False;False;False;False;False;False;False;False;False;False;False;False;False
premium;PILAR EMPREENDIMENTOS IMOBILIÁRIOS;137;114;Casa com 3 dormitórios, 137 m² venda por 620.000 ou aluguel por 3.600/mês mador - Eusébio/CE;Que tal morar no melhor do Eusébio com as melhores vantagens e condições especiais para você, então apresentamos a você o AMAZON BOULEVARD um empreendimento super completo com os melhores conceitos em conforto e segurança para você e sua família. Consulte nossos especialistas e AGENDE SUA VISITA...<br><br>O EMPREENDIMENTO<br><br>Área Construída :<br><br>137 m²<br><br>Nº de Unidades:<br>36 Casas Duplex<br><br>Nº de Quartos :<br><br>03 Suítes<br><br>Área de Lazer:<br><br>Piscina, Sauna Molhada, Espaço Gourmet, Salão de Festa, Espaço Kids, Academia, Churrasqueira<br><br>Vagas :<br><br>02 Vagas na Garagem<br><br>CASA PRONTA PARA MORAR<br><br><br>Nova sem uso -;2022-06-24T08:33:56.917Z;2023-05-05T08:49:31.373Z;;2;61760000;Rua Zildenia;Amador;;3;5;3;680.000;125;475;PREMIUM;HOME;;RESIDENTIAL;AIR_CONDITIONING|BARBECUE_GRILL|KITCHEN|GOURMET_BALCONY|INTERCOM|GARDEN|LAUNDRY|POOL|SPORTS_COURT|BALCONY|ALARM_SYSTEM|CABLE_TV|HOME_OFFICE|BACKYARD|SAUNA|SERVICE_AREA;;RENTAL_SALE;Bairros;False;Casa para alugar e comprar em;12675-J-CE;3.000;0;;False;USED;;UNIT;0;False;CA0203;True;Ceará;ROOFTOP;True;;Alugar/Comprar;BR;STREET;9b7c7208-1755-57e3-90eb-56f9313989aa;/imovel/venda-casa-3-quartos-com-piscina-amador-eusebio-ce-137m2-id-2568647461/;GRUPOZAP;2568647461;RENTAL;STREET;Eusébio;VALID_STREET;mês;3.475;3.000;casas;True;True;True;True;True;False;False;True;False;False;False;False;False;False;False;False;False
;Imobiliária Magno Muniz Ltda ME;118;118;Casa com 3 dormitórios para alugar, 117 m² por 2.911,18/mês - Aldeota - Fortaleza/CE;Imóvel perfeito para o seu negócio !!<br><br>Localiza na Rua Joaquim Siqueira, nº 21 - Aldeota à 50 metros da avenida Santos Dumont, esquina com a rua Leonardo Mota, rua movimentada, próximo a 3 Shoppings ( Aldeota, Del Paseo, Center Um e Jardins Open Mall), com bancos aos arredores e diversos pontos comerciais. O imóvel conta com a vantagem de está no centro de 4 grandes avenidas (Dom Luís, Santos Dumont, Virgílio Távora e Desembargador Moreira).<br><br>Excelente casa na parte superior medindo 117,98m², internamente com sala espaçosa c/ varanda, cozinha, área de serviço, 3 quartos, wc. social c/ box, dependência completa de empregada e 2 vagas na garagem.<br><br>Aluguel: R$2.800,00<br>IPTU 2023 - 11 x R$111,18<br><br>Agende já sua visita !!!! -;2022-09-15T09:51:03.651Z;2023-04-30T08:55:21.909Z;;2;60170080;Rua Joaquim Siqueira;Aldeota;21;0;2;3;;111;;STANDARD;HOME;;RESIDENTIAL;SERVICE_AREA;-3.736261;RENTAL;Bairros;False;Casa para alugar em;00769-J-CE;2.800;0;-38.496001;False;USED;GOOGLE;UNIT;0;False;CA0210;True;Ceará;ROOFTOP;False;;Alugar;BR;STREET;95437370-1b60-1e25-e19f-975437541f11;/imovel/aluguel-casa-3-quartos-com-area-de-servico-aldeota-fortaleza-ce-118m2-id-2580440038/;GRUPOZAP;2580440038;RENTAL;ALL;Fortaleza;VALID_STREET;mês;;2.800;casas;False;False;False;False;False;False;False;False;False;False;False;False;False;False;False;False;False
;A PREDIAL IMÓVEIS LTDA EPP;100;100;Casa para aluguel, 3 quartos, 1 suíte, 1 vaga, Mondubim - Fortaleza/CE;Agora você pode morar neste belo apartamento esquina com Spazio Buffet Milano.<br><br>- sala<br>- 3 quartos ( sendo 1 suíte)<br>- cozinha<br>- banheiro<br>- área de serviço<br>- quintal<br>- garagem<br><br>Não perca a oportunidade de está localizado próximo a restaurantes, rede de ensino, supermercados, entre outros. <br><br>Agende uma visita e confira agora mesmo.;2022-04-02T05:06:13.447Z;2023-05-05T12:25:35.350Z;0;1;60752370;Rua 7;Mondubim;;1;2;3;;119;;STANDARD;HOME;;RESIDENTIAL;GARAGE|KITCHEN|BACKYARD;;RENTAL;Bairros;False;Casa para alugar em;00051-J-CE;850;0;;False;USED;;UNIT;0;False;1744;True;Ceará;ROOFTOP;False;;Alugar;BR;STREET;fc5712e9-fa43-5098-d352-567837858f50;/imovel/aluguel-casa-3-quartos-mondubim-fortaleza-ce-100m2-id-2556957843/;GRUPOZAP;2556957843;RENTAL;STREET;Fortaleza;VALID_STREET;mês;;850;casas;False;False;True;False;False;False;False;False;False;False;False;False;False;False;False;False;False
;Alessandro Belchior Administração de Imóveis Ltda;140;140;CASA para alugar na cidade de FORTALEZA-CE;Casa com 3 quartos, 1 sendo suíte, armários, copa/ cozinha, área de serviço, garagem, próximo ao hospital Gênesis.;2022-10-26T12:24:41.520Z;2023-05-03T21:54:50.471Z;;0;60150120;Rua Padre Luís Figueira;Aldeota;255;1;3;3;;;;STANDARD;HOME;;RESIDENTIAL;;-3.732099;RENTAL;Bairros;False;Casa para alugar em;;1.600;0;-38.514707;False;USED;GOOGLE;UNIT;0;False;L137;True;Ceará;ROOFTOP;False;;Alugar;BR;STREET;61169048-ace0-3daa-e89c-3048088b59b5;/imovel/aluguel-casa-3-quartos-aldeota-fortaleza-ce-140m2-id-2587783911/;GRUPOZAP;2587783911;RENTAL;ALL;Fortaleza;VALID_STREET;mês;;1.600;casas;False;False;False;False;False;False;False;False;False;False;False;False;False;False;False;False;False
premium;DSF IMÓVEIS;130;300;Casa com 3 dormitórios para alugar, 130 m² por 700,00/ano - Novo Maranguape I - Maranguape/CE;Excelente imóvel para locação.<br><br>*Área<br>*Sala de visita/jantar<br>*Cozinha<br>*Três quartos<br>*Um banheiro.<br>*Área de serviço<br>*Quintal. -;2023-04-05T23:45:19.864Z;2023-05-05T08:38:33.523Z;;0;61943190;Rua Irmã Irene;Novo Maranguape I;121;0;1;3;;;;PREMIUM;HOME;;RESIDENTIAL;;-3.870868;RENTAL;Bairros;False;Casa para alugar em;00989-J-CE;700;0;-38.66797;False;USED;GOOGLE;UNIT;0;False;CA0118;True;Ceará;ROOFTOP;False;;Alugar;BR;STREET;26e4b662-433d-a345-4983-1bccb3367783;/imovel/aluguel-casa-3-quartos-novo-maranguape-i-maranguape-ce-130m2-id-2623327167/;GRUPOZAP;2623327167;RENTAL;ALL;Maranguape;VALID_STREET;mês;;700;casas;False;False;False;False;False;False;False;False;False;False;False;False;False;False;False;False;False
;IMOBILIÁRIA MARCELINO FREITAS;110;110;Casa com 3 dormitórios para alugar, 110 m² por 959,00/mês - Bonsucesso - Fortaleza/CE;(G-514) Excelente casa Duplex localizada a Rua Cosmonalta 247 casa 20 disponível para locação!<br><br>A casa possui 3 quartos, 2 banheiros, 2 salas, cozinha, área de serviço, vaga coberta na garagem e varanda.<br><br>Fale agora com nossos especialistas e confira:<br><br>/. WhatsApp: (85) 9.9848.4448<br>Atendimento de segunda a sexta das h às h e no sábado das h às h.<br><br>* Imóvel sujeito a alteração de valores. * -;2023-03-18T03:14:24.377Z;2023-04-28T09:31:37.596Z;;1;60541645;Rua Cosmonauta;Bonsucesso;247;0;2;3;;;;STANDARD;HOME;;RESIDENTIAL;KITCHEN|SERVICE_AREA;-3.787711;RENTAL;Bairros;False;Casa para alugar em;;959;0;-38.588983;False;USED;GOOGLE;UNIT;0;False;CA2805;True;Ceará;ROOFTOP;False;;Alugar;BR;STREET;81663c41-36c7-ac73-6866-62ab49b871ac;/imovel/aluguel-casa-3-quartos-com-cozinha-bonsucesso-fortaleza-ce-110m2-id-2619390644/;GRUPOZAP;2619390644;RENTAL;ALL;Fortaleza;VALID_STREET;mês;;959;casas;False;False;False;False;False;False;False;False;False;False;False;False;False;False;False;False;False
;JUSTA IMÓVEIS;160;160;Casa com 3 dormitórios para alugar, 160 m² por 4.000,00/mês - Centro - Eusébio/CE;Casa de condomínio para alugar no Eusébio, 3 quartos com suítes e com moveis, 160m², 3 vagas, WC social, disponível para locação.<br><br>Condomínio com ampla área de lazer: Piscina adulto e infantil, campo gramado, playground e deck na área comum do condomínio.<br><br>Valor do aluguel já incluso IPTU e taxa do condomínio.<br><br>Endereço: Rua São Mateus, 210/ Eusébio.<br>Ligue já e agende sua visita! -;2022-08-05T04:54:14.008Z;2023-05-05T07:51:36.422Z;;0;61760000;Rua São Mateus;Centro;;3;4;3;;;;STANDARD;HOME;;RESIDENTIAL;BARBECUE_GRILL|KITCHEN|POOL;;RENTAL;Bairros;False;Casa para alugar em;00874-J-CE;4.000;0;;False;USED;;UNIT;0;False;CA0142;True;Ceará;ROOFTOP;False;;Alugar;BR;STREET;466027bd-e77f-acc1-eb2b-e03ea00270c7;/imovel/aluguel-casa-3-quartos-com-piscina-centro-eusebio-ce-160m2-id-2574674721/;GRUPOZAP;2574674721;RENTAL;STREET;Eusébio;VALID_STREET;mês;;4.000;casas;True;False;False;False;True;False;False;False;False;False;False;False;False;False;False;False;False
;HABITE SOLUCOES IMOBILIARIAS LTDA - ME;120;120;Casa Padrão para Aluguel em Guararapes Fortaleza-CE - 10649;CASA PARA LOCAÇÃO NO BAIRRO GUARARAPES<br> <br>Excelente casa duplex para locação, área de 120 m², com 3 quartos, sendo 2 suítes, sala, cozinha, área de serviço e varanda. Casa ótima pra morada, muito arejada e bom acabamento.<br><br><br> Localizada nas proximidades do Shopping Iguatemi e Unifor.<br><br>Valor de Locação: 4.300,00 <br>Valor de IPTU/mensal: 220,38 <br><br> <br><br><br><br> As informações estão sujeitas a alterações. Consulte o corretor responsável.<br><br><br>-- Atualizado em: :09;2023-01-25T13:58:44.861Z;2023-05-04T13:05:53.290Z;;0;60810015;Rua Manuel Firmino Sampaio;Guararapes;258 A;2;1;3;;220;;STANDARD;HOME;;RESIDENTIAL;KITCHEN|NEAR_SHOPPING_CENTER;-3.760656;RENTAL;Bairros;False;Casa para alugar em;01156-J-CE;4.300;0;-38.484943;False;USED;GOOGLE;UNIT;0;False;10649;True;Ceará;ROOFTOP;False;;Alugar;BR;STREET;93b6e4bd-4af7-8816-766a-cbcf589120fc;/imovel/aluguel-casa-3-quartos-com-cozinha-guararapes-fortaleza-ce-120m2-id-2608275207/;GRUPOZAP;2608275207;RENTAL;ALL;Fortaleza;VALID_STREET;mês;;4.300;casas;False;False;False;False;False;False;False;False;False;False;False;False;False;False;False;False;False
;7Cantos;110;110;;Precisando de uma casa espaçosa pra acomodar a família toda? A 7Cantos te mostra uma opção perfeita. O imóvel possui 110m², sendo distribuído em: sala, 3 quartos, 2 banheiros sendo 1 suíte, cozinha, área de serviço, varanda e 1 vaga de garagem. O imóvel fica próximo das principais vias de acesso, supermercados, farmácias, restaurantes e bares. Não perca tempo e agende agora mesmo uma visita com um de nossos consultores;2022-07-11T23:40:10.964Z;2023-04-16T03:14:03.799Z;;1;60130371;Rua Monsenhor Salazar;São João do Tauape;2041;1;2;3;;1;1;STANDARD;HOME;;RESIDENTIAL;NEAR_SHOPPING_CENTER|NEAR_PUBLIC_TRANSPORT|NEAR_SCHOOL|NEAR_HOSPITAL|BALCONY|GARAGE|NEAR_ACCESS_ROADS|PETS_ALLOWED;-3.755219;RENTAL;Bairros;False;Casa para alugar em;10138-J-CE;2.200;0;-38.506084;False;USED;GOOGLE;UNIT;0;False;26329;True;Ceará;RANGE_INTERPOLATED;False;;Alugar;BR;STREET;6aea1890-014e-941d-06e4-90db3afb4a90;/imovel/aluguel-casa-3-quartos-sao-joao-do-tauape-fortaleza-ce-110m2-id-2571074301/;GRUPOZAP;2571074301;RENTAL;ALL;Fortaleza;VALID_STREET;mês;2.201;2.200;casas;False;False;False;False;False;False;False;False;False;False;False;False;False;False;False;False;False
;A PREDIAL IMÓVEIS LTDA EPP;65;65;Casa para aluguel, 3 quartos, 1 suíte, 1 vaga, Maraponga - Fortaleza/CE;Não perca a oportunidade de morar nesta casa com 3 quartos, ao lado do Colégio Provecto e Lagoa da Maraponga.<br><br>- garagem<br>- varanda<br>- sala<br>- 1 suíte<br>- banheiro social<br>- cozinha<br>- área de serviço<br>- quintal<br><br>O melhor de tudo é que está localizada a duas quadras da Avenida Godofredo Maciel, restaurantes, bancos, farmácias, posto de combustível, entre outros.<br><br>Agende uma visita e confira agora mesmo!;2022-05-31T18:33:28.568Z;2023-05-05T12:25:35.412Z;0;1;60711035;Rua Suíça;Maraponga;;1;2;3;;80;;STANDARD;HOME;;RESIDENTIAL;BALCONY|GARAGE|KITCHEN;;RENTAL;Bairros;False;Casa para alugar em;00051-J-CE;1.300;0;;False;USED;;UNIT;0;False;1962;True;Ceará;ROOFTOP;False;;Alugar;BR;STREET;fc5712e9-fa43-5098-d352-567837858f50;/imovel/aluguel-casa-3-quartos-com-varanda-maraponga-fortaleza-ce-65m2-id-2564911194/;GRUPOZAP;2564911194;RENTAL;STREET;Fortaleza;VALID_STREET;mês;;1.300;casas;False;False;False;False;False;False;False;False;False;False;False;False;False;False;False;False;False
premium;SJ IMOVEIS;246;246;FORTALEZA - Casa Padrão - ENG LUCIANO CAVALCANTE;Ampla casa no bairro Luciano Cavalcante, localizada na Travessa Coronel João Paulino, a poucos metros da Av. Rogaciano Leite. Imóvel com 246m², 3 quartos, sendo 1 suíte, sala, cozinha, área de serviço, despensa, banheiro social, dependência para empregada com banheiro, quintal, áreas frontal e lateral, piso de cerâmica e 2 vagas na garagem. Agende já sua visita!;2022-08-09T17:58:19Z;2023-05-05T09:54:36.014Z;;2;60822160;;Engenheiro Luciano Cavalcante;;1;1;3;;;;PREMIUM;HOME;;RESIDENTIAL;NUMBER_OF_FLOORS|BACKYARD|SERVICE_AREA;;RENTAL;Bairros;False;Casa para alugar em;00350-J-CE;2.200;0;;False;USED;;UNIT;0;False;22427;True;Ceará;RANGE_INTERPOLATED;False;;Alugar;BR;STREET;f060bc0a-ee24-9158-a856-e878deddd620;/imovel/aluguel-casa-3-quartos-engenheiro-luciano-cavalcante-fortaleza-ce-246m2-id-2575260824/;GRUPOZAP;2575260824;RENTAL;NEIGHBORHOOD;Fortaleza;VALID_STREET;mês;;2.200;casas;False;False;True;False;False;False;False;False;False;False;False;False;False;False;False;False;False
;Alessandro Belchior Administração de Imóveis Ltda;4065;4065;CASA para alugar na cidade de CAUCAIA-CE;Casa com piscina - campo de futebol - 6 vagas de garagem - 01 Suíte, 02 dormitórios, cozinha.;2022-05-04T00:33:36.997Z;2023-04-24T12:53:38.910Z;;6;61629365;Rua Iguatu;Pacheco;100;1;1;3;;;;STANDARD;HOME;;RESIDENTIAL;;-3.696681;RENTAL;Bairros;False;Casa para alugar em;;1.800;0;-38.640892;False;USED;GOOGLE;UNIT;0;False;L14173;True;Ceará;RANGE_INTERPOLATED;False;;Alugar;BR;STREET;61169048-ace0-3daa-e89c-3048088b59b5;/imovel/aluguel-casa-3-quartos-pacheco-caucaia-ce-4065m2-id-2561222176/;GRUPOZAP;2561222176;RENTAL;ALL;Caucaia;VALID_STREET;mês;;1.800;casas;False;False;False;False;False;False;False;False;False;False;False;False;False;False;False;False;False
;Imobiliária Torres de Melo Neto LTDA;60;60;Casa para alugar no bairro Álvaro Weyne;Casa residencial localizada na Rua 17 de Junho, com 3 quartos, wc social, sala, cozinha, área de serviço, 1 vaga, área privativa de 60m². A localização privilegiada dessa casa é um dos seus principais atrativos, pois está situada em um bairro tranquilo eresidencial, próximo a diversos comércios, escolas, hospitais e transporte público, facilitando assim, sua rotina diária. Não perca tempo e agende agora mesmo uma visita para conhecer pessoalmente essa excelente oportunidade de moradia.;2023-04-28T21:17:50.401Z;2023-05-04T21:27:02.403Z;;0;60336390;Rua Dezessete de Junho;Álvaro Weyne;155;0;1;3;;;;STANDARD;HOME;;RESIDENTIAL;;-3.714751;RENTAL;Bairros;False;Casa para alugar em;01365-J-CE;950;0;-38.574765;False;USED;GOOGLE;UNIT;0;False;L4182;True;Ceará;ROOFTOP;False;;Alugar;BR;STREET;c1fee7e4-fa79-f695-7ce8-514a5578ca9d;/imovel/aluguel-casa-3-quartos-alvaro-weyne-fortaleza-ce-60m2-id-2629141534/;GRUPOZAP;2629141534;RENTAL;ALL;Fortaleza;VALID_STREET;mês;;950;casas;False;False;False;False;False;False;False;False;False;False;False;False;False;False;False;False;False
