type;account.name;listing.usableAreas;listing.totalAreas;listing.title;listing.description;listing.createdAt;listing.updatedAt;listing.floors;listing.parkingSpaces;listing.address.zipCode;listing.address.street;listing.address.neighborhood;listing.address.streetNumber;listing.suites;listing.bathrooms;listing.bedrooms;listing.pricingInfo.salePrice;listing.pricingInfo.yearlyIptu;listing.pricingInfo.monthlyCondoFee;listing.publicationType;listing.unitTypes;listing.unitSubTypes;listing.usageTypes;listing.amenities;listing.address.point.lat;listing.pricingInfo.businessType;listing.address.zone;listing.acceptExchange;listing.subtitle;account.licenseNumber;listing.pricingInfo.price;listing.unitFloor;listing.address.point.lon;listing.preview;listing.listingType;listing.address.point.source;listing.propertyType;listing.unitsOnTheFloor;listing.isInactive;listing.externalId;listing.pricingInfo.isRent;listing.address.state;listing.address.precision;listing.pricingInfo.isSale;listing.legacyId;listing.pricingInfo.businessLabel;listing.address.country;listing.address.level;listing.advertiserId;listing.link;listing.portal;listing.id;listing.businessTypeContext;listing.displayAddressType;listing.address.city;listing.address.confidence;listing.pricingInfo.period;listing.pricingInfo.rentalTotalPrice;listing.pricingInfo.rentalPrice;imvl_type;listing.pool;listing.sauna;listing.backyard;listing.garden;listing.barbgrill;listing.partyhall;listing.tenniscourt;listing.sportcourt;listing.bathtub;listing.soundproofing;listing.fireplace;listing.gym;listing.hottub;listing.furnished;listing.guestpark;listing.playground;listing.mountainview
superPremium;RE/MAX PAX;122;122;Casa para locação de 122m² com 3 suítes em Messejana: Conforto e comodidade em um dos bairros mais p;Esta casa localizada no bairro de Messejana em Fortaleza oferece todo o conforto e comodidade que você e sua família precisam. Com uma área construída de 122m², a casa é composta por 3 suítes, uma ampla sala de estar, cozinha, área de serviço e varanda.<br><br>As suítes são espaçosas e arejadas, com janelas que permitem a entrada de luz natural. Cada suíte é equipada com armários embutidos e banheiros completos.<br><br>A sala de estar é ideal para momentos de convivência em família, com espaço suficiente para acomodar confortavelmente um sofá e uma mesa de jantar. A cozinha é prática e funcional, equipada com armários planejados e uma bancada de granito. Já a área de serviço conta com tanque e espaço para máquina de lavar.<br><br>A suíte master também conta com uma varanda, ideal para relaxar e desfrutar do clima agradável de Fortaleza. Além disso, há duas vagas de garagem cobertas.<br><br>A casa está próxima a uma ampla rede de serviços e comércios, incluindo supermercados, farmácias, escolas e shoppings. Além disso, está a poucos minutos de distância do Aeroporto Internacional de Fortaleza.<br><br>Não perca a oportunidade de morar em uma casa confortável e aconchegante em um dos bairros mais populares de Fortaleza. Venha conhecer esta incrível opção de locação em Messejana!<br><br>Casa Duplex - 122m² de área construída.<br><br>Excelente casa duplex no bairro Messejana em Fortaleza, próximo ao Corpo de Bombeiros e ao 6º Distrito Policial da Rua Padre Pedro de Alencar.<br><br>Fica à 5 minutos do Centro de Messejana onde você encontra todos os serviços de que necessita como : bancos, farmácias, postos de gasolina, padarias, lojas de vários tipos de comércio, supermercados além de fácil acesso às principais rotas da cidade.<br><br>* Pavimento inferior com:<br>Sala de estar/jantar, banheiro social, cozinha, quintal, área de serviço e duas vagas de garagem.<br><br>* Pavimento superior com:<br>3 suítes sendo uma master com varanda, todas com ar condicionado split.<br><br>Portão automático.<br><br>Entre em contato para mais informações.<br><br>(85)9.<br>Gustavo Martins - Creci - 20020 -;2023-04-21T01:17:34.806Z;2023-05-04T21:13:56.802Z;;2;60871120;Rua Miracema;Messejana;305;;4;3;;;;SUPER_PREMIUM;HOME;;RESIDENTIAL;BALCONY|BARBECUE_GRILL|GARAGE|GARDEN|PETS_ALLOWED;-3.837174;RENTAL;Bairros;False;Casa para alugar em;01135-J-CE;2.500;0;-38.497189;False;USED;GOOGLE;UNIT;0;False;721621018-6;True;Ceará;ROOFTOP;False;;Alugar;BR;STREET;5d22ee2c-6c4e-4595-61cc-f65709fb0a51;/imovel/aluguel-casa-3-quartos-com-churrasqueira-messejana-fortaleza-ce-122m2-id-2627551781/;GRUPOZAP;2627551781;RENTAL;ALL;Fortaleza;VALID_STREET;mês;;2.500;casas;False;False;False;True;True;False;False;False;False;False;False;False;False;False;False;False;False
superPremium;Imobiliária Luiz Rêgo;98;98;CA964 - Aluga casa na Castelão com 3 quartos sendo 2 suítes, e 1 vaga.;CA964 - Imobiliária Luiz Rêgo aluga casa no Castelão, com:<br><br>varanda / sala dois ambientes / 3 quartos ( 2 suítes- sendo 1 reversível) /cozinha / banheiro social /área de serviço / quintal / 1 vaga / cerca elétrica / portão automático.<br><br>Seguro incêndio: 239,19 (anual)<br><br>Taxa do lixo: 268,17 (anual)<br><br>Alugamos com fiador ou caução. -;2023-04-08T22:06:41.534Z;2023-05-05T02:52:29.140Z;;1;60867530;Rua Maestro Néo Miranda;Castelão;237;2;2;3;;469;;SUPER_PREMIUM;HOME;;RESIDENTIAL;KITCHEN|BACKYARD|SERVICE_AREA;-3.801987;RENTAL;Bairros;False;Casa para alugar em;00458-J-CE;1.500;0;-38.518259;False;USED;GOOGLE;UNIT;0;False;CA0036;True;Ceará;ROOFTOP;False;;Alugar;BR;STREET;e611d648-5cc3-05d3-1e6e-79b428e8c31e;/imovel/aluguel-casa-3-quartos-com-cozinha-castelao-fortaleza-ce-98m2-id-2624757529/;GRUPOZAP;2624757529;RENTAL;ALL;Fortaleza;VALID_STREET;mês;;1.500;casas;False;False;True;False;False;False;False;False;False;False;False;False;False;False;False;False;False
superPremium;MEGA VENDA DE IMOVEIS,SERVIÇOS E CONDOMINIO LTDA;210;228;Casa com 3 dormitórios para alugar, 209 m² por 2.400,00/ano - São Bento - Fortaleza/CE;Localizado a 3 quadras da Av. Edson Magalhães, próximo ao Estádio Moreirão, Colégio Joaquim Barroso Neto, Nova Fitness Academia, Farmácia Droga Life, com fácil acesso a Av. Dr. Mendel Steinbruch, Banco Santander e outras conveniências.<br>Casa duplex dispõe de 130 m², sala ampla, cozinha, 3 suíte, closet, varanda, banheiro social, área de serviço, deck com churrasqueira e 3 vagas de garagem.<br>Venha conhecer! -;2022-06-24T08:34:38.447Z;2023-05-03T03:38:46.023Z;;3;60875600;;São Bento;;3;4;3;;;;SUPER_PREMIUM;HOME;;RESIDENTIAL;BARBECUE_GRILL|KITCHEN|BACKYARD|SERVICE_AREA;;RENTAL;Bairros;False;Casa para alugar em;;2.400;0;;False;USED;;UNIT;0;False;CA0927;True;Ceará;RANGE_INTERPOLATED;False;;Alugar;BR;STREET;d799ba7e-10ff-931b-817a-f11141492529;/imovel/aluguel-casa-3-quartos-com-churrasqueira-sao-bento-fortaleza-ce-210m2-id-2568649910/;GRUPOZAP;2568649910;RENTAL;NEIGHBORHOOD;Fortaleza;VALID_STREET;mês;;2.400;casas;False;False;True;False;True;False;False;False;False;False;False;False;False;False;False;False;False
;Amauri Gomes Negócios Imobiliários;160;;Casa - Rua Azevedo Bolão, 916 - Parque Araxá;Casa com sala, 03 quartos(02 suítes), 02 jardins de inverno, copa/cozinha, área de serviço, despensa, lavanderia, quintal, quarto de despejo e 01 vaga de garagem.<br><br>IPTU……1.105,47<br>TMRSU…..436,90<br>SCI…….(+ou-)215,00 (ano)<br><br>Ponto de referência: Próximo ao Frangolândia Supermercado Parque Araxá.;2023-04-19T15:30:09.307Z;2023-04-19T15:30:21.889Z;;1;60450675;Rua Azevedo Bolão;Parque Araxá;916;2;2;3;;1.106;;STANDARD;HOME;;RESIDENTIAL;;-3.73537;RENTAL;Bairros;False;Casa para alugar em;;1.500;0;-38.552486;False;USED;GOOGLE;UNIT;0;False;VNPGPD;True;Ceará;ROOFTOP;False;;Alugar;BR;STREET;409ac94a-3caf-ac0a-1e48-cf47dfe6607b;/imovel/aluguel-casa-3-quartos-parque-araxa-fortaleza-ce-160m2-id-2627237318/;GRUPOZAP;2627237318;RENTAL;ALL;Fortaleza;VALID_STREET;mês;;1.500;casas;False;False;False;False;False;False;False;False;False;False;False;False;False;False;False;False;False
premium;Fenix Imóveis e Serviços Ltda;240;324;Casa com 3 quartos para alugar, 240 m² por 2.605/mês - Vila União - Fortaleza/CE;Casa no Vila União, ampla e próximo da Etufor, da rodoviária Engenheiro João Thomé (Av. Borges de Melo) e do Hospital Infantil Albert Sabin.<br><br>Terreno 12 x 27, totalizando 324 m² com 240 m² de área construída com sala, varanda, 03 quartos (sendo 1 suíte), gabinete, WC social, cozinha, copa, dependência completa e área de serviço.<br><br>*05 vagas na garagem.<br><br>Localização:Rua Esperanto , nº 1500 - Vila União<br><br>Agende já sua visita!Não perca essa oportunidade! -;2023-04-24T22:23:31.722Z;2023-04-24T22:23:52.324Z;;5;60410622;Rua Esperanto;Vila União;1500;1;3;3;;106;;PREMIUM;HOME;;RESIDENTIAL;KITCHEN|BACKYARD|SERVICE_AREA;-3.767304;RENTAL;Bairros;False;Casa para alugar em;00615-J-CE;2.500;0;-38.540531;False;USED;GOOGLE;UNIT;0;False;CA0007;True;Ceará;ROOFTOP;False;;Alugar;BR;STREET;457da9fc-8393-1e8b-181b-01a386b52087;/imovel/aluguel-casa-3-quartos-com-cozinha-vila-uniao-fortaleza-ce-240m2-id-2628143466/;GRUPOZAP;2628143466;RENTAL;ALL;Fortaleza;VALID_STREET;mês;;2.500;casas;False;False;True;False;False;False;False;False;False;False;False;False;False;False;False;False;False
;J Botelho Imóveis;170;;Casa para aluguel com 170 metros quadrados com 3 quartos em Serrinha - Fortaleza - CE;Casa com 3 quartos para LOCAÇÃO disponível no bairro Serrinha.<br><br>Imóvel com excelente localização, próximo as principais vias de acesso e pontos comerciais. De frente as lojas Americanas e ao lado do Super do Povo<br><br>- 3 quartos, 1 suíte<br>- 3 banheiros<br>- Sala de estar ampla e cozinha integrada<br>- Lavanderia <br>- Quintal <br><br>Valor da locação: R$1.500,00<br>Garantia: Seguro fiança, caução ou fiador;2023-04-27T17:38:38.657Z;2023-04-27T17:38:43.669Z;;1;60741575;Avenida Doutor Silas Munguba;Serrinha;4797;1;3;3;;714;;STANDARD;HOME;;RESIDENTIAL;;-3.795233;RENTAL;Bairros;False;Casa para alugar em;20641-J-CE;1.500;0;-38.532761;False;USED;GOOGLE;UNIT;0;False;CAJ1R2D3R;True;Ceará;RANGE_INTERPOLATED;False;;Alugar;BR;STREET;33efc62d-7487-6291-61d1-c10c3c025cb7;/imovel/aluguel-casa-3-quartos-serrinha-fortaleza-ce-170m2-id-2628830956/;GRUPOZAP;2628830956;RENTAL;ALL;Fortaleza;VALID_STREET;mês;;1.500;casas;False;False;False;False;False;False;False;False;False;False;False;False;False;False;False;False;False
;Simone Ulisses;130;200;Casa para aluguel tem 130 metros quadrados com 3 quartos em São José - Juazeiro do Norte - CE;A casa está localizado no bairro São José com 130 metros quadrados com 3 quartos sendo 1 suite e 2 banheiros;2023-05-04T13:00:57.705Z;2023-05-04T13:01:01.388Z;;2;63024810;Rua Elias Pereira de Brito;São José;14;1;2;3;;200;;STANDARD;HOME;;RESIDENTIAL;;-7.217027;RENTAL;Bairros;False;Casa para alugar em;17503-F-CE;1.000;0;-39.336327;False;USED;GOOGLE;UNIT;0;False;1762HKG;True;Ceará;GEOMETRIC_CENTER;False;;Alugar;BR;STREET;5193d6a7-ac8b-d51d-3cfe-7d0e4aba3ef3;/imovel/aluguel-casa-3-quartos-sao-jose-juazeiro-do-norte-ce-130m2-id-2630140131/;GRUPOZAP;2630140131;RENTAL;ALL;Juazeiro do Norte;VALID_STREET;mês;;1.000;casas;False;False;False;False;False;False;False;False;False;False;False;False;False;False;False;False;False
premium;Mellro;90;90;Aluguel de Casa no Bairro Itaperi. Direto com o dono!;Aluguel rápido e fácil!<br>Com a Mell.ro você aluga um imóvel com a rapidez que precisa. Você vai passar por uma análise de crédito e se aprovado, basta pagar o 1º aluguel. Nada de fiador ou caução.<br>Entre em contato e siga as instruções para negociar.;2023-05-03T04:56:41.461Z;2023-05-04T16:58:45.535Z;;1;60714350;Rua Recanto Tranquilo;Itaperi;419;;2;3;;130;;PREMIUM;HOME;;RESIDENTIAL;;-3.792733;RENTAL;Bairros;False;Casa para alugar em;;1.350;0;-38.545748;False;USED;GOOGLE;UNIT;0;False;79f88300-46d0-49c1-acf6-33e2462b67dc;True;Ceará;ROOFTOP;False;;Alugar;BR;STREET;de28b6fb-7092-104e-28d3-640be125c43f;/imovel/aluguel-casa-3-quartos-itaperi-fortaleza-ce-90m2-id-2629831760/;GRUPOZAP;2629831760;RENTAL;ALL;Fortaleza;VALID_STREET;mês;;1.350;casas;False;False;False;False;False;False;False;False;False;False;False;False;False;False;False;False;False
;Thalisson G. Albuquerque;155;245;Casa para aluguel com 155 metros quadrados com 3 quartos em São Gerardo - Fortaleza - CE;A casa no bairro São Gerardo localizado na Rua Haroldo Torres n²228 possui 155 metros quadrados com 3 quartos sendo 1 suite e 2 banheiros até 05 vagas na garagem, em excelente localização próximo a tudo.<br><br> agende uma visita nos telefones acima.;2023-04-20T15:04:50.072Z;2023-04-20T19:20:34.737Z;;5;60320845;Rua Haroldo Torres;Sao Gerardo;228;1;2;3;;1;1;STANDARD;HOME;;RESIDENTIAL;;-3.726762;RENTAL;Bairros;False;Casa para alugar em;;1.809;0;-38.555911;False;USED;GOOGLE;UNIT;0;False;1H1DS0U;True;Ceará;ROOFTOP;False;;Alugar;BR;STREET;224132cd-4c9a-3743-c382-c359e8792ba6;/imovel/aluguel-casa-3-quartos-sao-gerardo-fortaleza-ce-155m2-id-2627459165/;GRUPOZAP;2627459165;RENTAL;ALL;Fortaleza;VALID_STREET;mês;1.810;1.809;casas;False;False;False;False;False;False;False;False;False;False;False;False;False;False;False;False;False
;VETTOR IMÓVEIS;130;;Casa para alugar na Sapiranga;Casa plana com 130m², Sala ampla para dois ambientes, cozinha americana, despensa, 3 quartos sendo 2 suítes e uma suíte reversível, ar-condicionado, corredor lateral, área de serviço, 3 vagas de garagem, portão eletrônico, Churrasqueira.;2023-05-02T17:53:58.803Z;2023-05-02T17:54:02.840Z;;2;60833075;Rua Marcelino Lopes;Sapiranga;4519;3;3;3;;79;;STANDARD;HOME;;RESIDENTIAL;PETS_ALLOWED|AIR_CONDITIONING;-3.791255;RENTAL;Bairros;False;Casa para alugar em;11894-F-CE;2.100;0;-38.460122;False;USED;GOOGLE;UNIT;0;False;8C2RB9;True;Ceará;ROOFTOP;False;;Alugar;BR;STREET;a600024f-aa86-2740-2610-cad2a1165430;/imovel/aluguel-casa-3-quartos-sapiranga-fortaleza-ce-130m2-id-2629706293/;GRUPOZAP;2629706293;RENTAL;ALL;Fortaleza;VALID_STREET;mês;;2.100;casas;False;False;False;False;False;False;False;False;False;False;False;False;False;False;False;False;False
;Adriano Freire Imóveis;78;78;Casa com 3 quartos, em Condomínio na Cidade 2000. - CA45390;Adriano Freire Imóveis aluga casa no Condomínio Village Del Leste.<br><br>Casa projetada com 3 quartos(2 suítes), varanda, sala para 2 ambientes, cozinha, área de serviço e 2 vagas de garagem. <br><br><br>O Condomínio dispõe de: <br>piscina, playground, deck com churrasqueira, campinho gramado, interfone, câmeras de segurança, cerca elétrica, guarita e portão automático. <br><br><br>Localização: Rua Zuca Acioly, 633, Cidade 2000.<br>Próximo a Praia do Futuro, fácil acesso ao Hospital São Matheus, Shopping Iguatemi e Shopping RioMar.<br><br><br>Para mais informações ou para agendar a sua visita, fale conosco através do nosso Whatsapp Comercial (85) 9..<br><br><br> <br><br><br><br>Atualizado quinta, 04 maio 2023;2023-05-05T00:25:48.504Z;2023-05-05T00:25:50.323Z;;2;60190170;Alameda Maria Doralice;Cidade 2000;633;2;3;3;;80;550;STANDARD;HOME;;RESIDENTIAL;POOL|PLAYGROUND|BARBECUE_GRILL|GOURMET_BALCONY;-3.750628;RENTAL;Bairros;False;Casa para alugar em;18703-J-CE;1.600;0;-38.467954;False;USED;GOOGLE;UNIT;0;False;CA45390;True;Ceará;RANGE_INTERPOLATED;False;;Alugar;BR;STREET;aaa31266-c13f-74ad-1f85-5efc14307444;/imovel/aluguel-casa-3-quartos-com-piscina-cidade-2000-fortaleza-ce-78m2-id-2630247481/;GRUPOZAP;2630247481;RENTAL;ALL;Fortaleza;VALID_STREET;mês;2.150;1.600;casas;True;False;False;False;True;False;False;False;False;False;False;False;False;False;False;True;False
;IMOBILIARIA SAVIO CAMILO LTDA;120;300;Casa para aluguel tem 120 m2com 3 quartos em Maraponga - Fortaleza - Ceará;Rua paurilo barroso 988<br><br>A casa está localizado no bairro Mondubim tem 120 metros quadrados com 3 quartos sendo 1 suite e 3 banheiros;2023-03-29T12:00:37.060Z;2023-03-29T12:00:39.395Z;;2;60711485;Rua Paurilo Barroso;Maraponga;988;1;3;3;;;;STANDARD;HOME;;RESIDENTIAL;PETS_ALLOWED;-3.8072;RENTAL;Bairros;False;Casa para alugar em;00565-J-CE;1.600;0;-38.571771;False;USED;GOOGLE;UNIT;0;False;e37fe5;True;Ceará;ROOFTOP;False;;Alugar;BR;STREET;a4e816b2-82c4-7669-5431-84f201908a92;/imovel/aluguel-casa-3-quartos-maraponga-fortaleza-ce-120m2-id-2621523121/;GRUPOZAP;2621523121;RENTAL;ALL;Fortaleza;VALID_STREET;mês;;1.600;casas;False;False;False;False;False;False;False;False;False;False;False;False;False;False;False;False;False
;SM - ADMINISTRADORA LTDA - ME;140;140;Casa em condomínio de 140m² por R$1400,00- José de Alencar/ Fortaleza- CE;Casa Duplex em condomínio com 140m²: Sala, Cozinha, 3 quartos sendo 1 suíte, Wc Social, Lavabo, Lavanderia, Quintal, Varanda, Despensa. Piscina, Salão de Festas, Campo, Deck, Churrasqueira, 02 vagas.;2023-04-20T15:03:03.074Z;2023-04-20T15:03:04.225Z;;0;60833201;Avenida Presidente Artur Bernardes;Sapiranga;2757;1;4;3;;;;STANDARD;HOME;;RESIDENTIAL;;-3.805679;RENTAL;Bairros;False;Casa para alugar em;00642-J-CE;1.400;0;-38.470104;False;USED;GOOGLE;UNIT;0;False;L158;True;Ceará;ROOFTOP;False;;Alugar;BR;STREET;0efc5b95-8dd3-28de-5154-ff535dee9561;/imovel/aluguel-casa-3-quartos-sapiranga-fortaleza-ce-140m2-id-2627459996/;GRUPOZAP;2627459996;RENTAL;ALL;Fortaleza;VALID_STREET;mês;;1.400;casas;False;False;False;False;False;False;False;False;False;False;False;False;False;False;False;False;False
;SOL NASCENTE CONSULTORIA E IMOBILIARIA LTDA - ME;112;108;Casa com 3 dormitórios para alugar, 112 m² por 1.791,33/mês - Coité - Eusébio/CE;Com 112m² de área construída, medindo 6m de frente por 18m de comprimento, ótima localização, 3 quartos, sendo 2 suítes, sala de estar e jantar, escritório opcional, cozinha convencional com móveis projetados, WC social, área de serviço, quintal e 2 vagas de garagem.<br><br>Excelente oportunidade de morar no Eusébio com ótimo custo benefício.<br><br>Não perca essa oportunidade!<br>Entre em contato, consulte condições e agende sua visita!<br>*PREÇO SUJEITO À ALTERAÇÃO SEM AVISO PRÉVIO -;2023-05-04T21:00:18.074Z;2023-05-05T09:00:33.675Z;;2;61760000;;Coité;;2;3;3;;90;1;STANDARD;HOME;;RESIDENTIAL;KITCHEN|BACKYARD|SERVICE_AREA;;RENTAL;Bairros;False;Casa para alugar em;00749-J-CE;1.700;0;;False;USED;;UNIT;0;False;CA2736;True;Ceará;RANGE_INTERPOLATED;False;;Alugar;BR;STREET;c27910a9-7ff5-fbc7-b3a8-8deca3b971d2;/imovel/aluguel-casa-3-quartos-com-cozinha-coite-eusebio-ce-112m2-id-2630220694/;GRUPOZAP;2630220694;RENTAL;NEIGHBORHOOD;Eusébio;VALID_STREET;mês;1.701;1.700;casas;False;False;True;False;False;False;False;False;False;False;False;False;False;False;False;False;False
;Maécio Feitosa;92;150;Casa para aluguel tem 78 metros quadrados com 3 quartos;Linda casa com 3 quartos sendo 1 suíte e 2 banheiros ,churrasqueira ,chuveirão. <br>A área é super tranquila tem fácil acesso a tudo o que você precisa: Escola , Farmácia, Posto de combustível,churrascaria,5 min do quarto anel viário.<br>Sabe aquele clima de quem está fora do movimento da cidade? Se você quer essa tranquilidade, esse é seu lugar! super aconchegante, arejado .<br>Você também encontra espaço para jardim para plantar hortas, flores e até um pequeno pomar. Na garagem, há vaga para dois carros.<br>É segurança, conforto e qualidade de vida que você procura, não é? Então, encontrou o seu lugar. Agende uma visita e conheça um recanto privilegiado para morar!”;2023-04-24T18:30:14.597Z;2023-04-24T20:37:38.173Z;;2;61880000;;;140;1;2;3;;;;STANDARD;HOME;;RESIDENTIAL;;-3.971575;RENTAL;;False;Casa para alugar em;10972-F-CE;900;0;-38.527646;False;USED;GOOGLE;UNIT;0;False;CASA ANCURI;True;Ceará;APPROXIMATE;False;;Alugar;BR;CITY;d11f2ae7-d124-4fee-e470-255d3a8de779;/imovel/aluguel-casa-3-quartos-itaitinga-ce-92m2-id-2628116063/;GRUPOZAP;2628116063;RENTAL;ALL;Itaitinga;VALID_STREET;mês;;900;casas;False;False;False;False;False;False;False;False;False;False;False;False;False;False;False;False;False
;SJ IMOVEIS;132;132;FORTALEZA - Casa Padrão - CASTELÃO;Excelente opção de casa para quem está em busca de um ambiente espaçoso para família. Localizada na rua Humberto Holanda Cassunde, próximo a Arena Castelão, ao Nidobox Supermercado e a poucos minutos do Zoológico Municipal Sargento Prata. O imóvel possui 3 quartos, sendo 1 suíte, sala, varanda, cozinha, 2 banheiros, área de serviço, 3 vagas na garagem, armário na cozinha e em 1 banheiro. Agende agora mesmo sua visita e aproveite!;2023-04-21T06:14:37.862Z;2023-05-05T09:54:37.456Z;;3;60867560;;Castelão;;1;2;3;;;;STANDARD;HOME;;RESIDENTIAL;KITCHEN_CABINETS|BALCONY|SERVICE_AREA;;RENTAL;Bairros;False;Casa para alugar em;00350-J-CE;1.500;0;;False;USED;;UNIT;0;False;53106;True;Ceará;ROOFTOP;False;;Alugar;BR;STREET;f060bc0a-ee24-9158-a856-e878deddd620;/imovel/aluguel-casa-3-quartos-com-armario-de-cozinha-castelao-fortaleza-ce-132m2-id-2627600841/;GRUPOZAP;2627600841;RENTAL;NEIGHBORHOOD;Fortaleza;VALID_STREET;mês;;1.500;casas;False;False;False;False;False;False;False;False;False;False;False;False;False;False;False;False;False
;Imobiliária Torres de Melo Neto LTDA;100;100;Casa de 100m² no bairro Centro por 750,00;Excelente oportunidade de locação residencial na Rua Bia! Esta casa confortável e aconchegante conta com 3 quartos, sendo 1 suíte, 2 banheiros sociais, sala de estar e jantar, cozinha e área de serviço, tudo distribuído em uma área privativa de 100m². Além disso, a localização é simplesmente incrível! Situado próximo a igreja, restaurantes, supermercados e muito mais, você terá tudo o que precisa ao seu alcance.;2023-04-28T21:17:43.647Z;2023-05-03T21:24:18.653Z;;0;62840000;Rua Coronel Bia;Centro;152;1;2;3;;;;STANDARD;HOME;;RESIDENTIAL;;-4.183136;RENTAL;Bairros;False;Casa para alugar em;01365-J-CE;750;0;-38.126765;False;USED;GOOGLE;UNIT;0;False;L3703;True;Ceará;ROOFTOP;False;;Alugar;BR;STREET;c1fee7e4-fa79-f695-7ce8-514a5578ca9d;/imovel/aluguel-casa-3-quartos-centro-beberibe-ce-100m2-id-2629142000/;GRUPOZAP;2629142000;RENTAL;ALL;Beberibe;VALID_STREET;mês;;750;casas;False;False;False;False;False;False;False;False;False;False;False;False;False;False;False;False;False
;Adriano Freire Imóveis;200;200;Casa Dupléx com 3 quartos próximo da Avenida José Bastos - CA45629;Adriano Freire Imóveis vende ou aluga casa no Bom Sucesso.<br><br><br>Excelente casa dúplex com 3 quartos (sendo 1 suíte), sala de estar, sala de jantar com despensa, cozinha com armários, banheiro social, área de serviço e quintal.<br><br><br>Localização: Rua Luís de Castro, 255, Bom Sucesso.<br>Próximo do North Shopping Jockey e do Shopping Parangaba.<br><br><br>Agende a sua visita através do nosso WhatsApp Comercial: (85)9..<br><br><br>Atualizado sexta, 05 maio 2023;2023-05-05T12:26:34.441Z;2023-05-05T12:26:36.719Z;;3;60520485;Rua Luís de Castro;Bonsucesso;255;1;2;3;350.000;90;;STANDARD;HOME;;RESIDENTIAL;;-3.777113;RENTAL_SALE;Bairros;False;Casa para alugar e comprar em;18703-J-CE;1.500;0;-38.577633;False;USED;GOOGLE;UNIT;0;False;CA45629;True;Ceará;ROOFTOP;True;;Alugar/Comprar;BR;STREET;aaa31266-c13f-74ad-1f85-5efc14307444;/imovel/venda-casa-3-quartos-bonsucesso-fortaleza-ce-200m2-id-2630384500/;GRUPOZAP;2630384500;RENTAL;ALL;Fortaleza;VALID_STREET;mês;;1.500;casas;False;False;False;False;False;False;False;False;False;False;False;False;False;False;False;False;False
premium;VETTOR IMÓVEIS;130;130;Casa para aluguel tem 130 metros quadrados com 3 quartos em José de Alencar - Fortaleza - CE;A casa no bairro José de Alencar tem 130 metros quadrados com 3 quartos sendo 3 suites e 4 banheiros<br>Possui área verde de jardim.<br>Cozinha convencional com alguns moveis projetados <br>Casa de Esquina;2023-04-27T14:11:07.140Z;2023-05-02T16:16:56.505Z;;5;60830075;Rua São João Del Rei;JOSE DE ALENCAR;2112;3;4;3;;73;;PREMIUM;HOME;;RESIDENTIAL;GARDEN|DISABLED_ACCESS;-3.801215;RENTAL;Bairros;False;Casa para alugar em;11894-F-CE;2.500;0;-38.469333;False;USED;GOOGLE;UNIT;0;False;1T4QRB9;True;Ceará;ROOFTOP;False;;Alugar;BR;STREET;a600024f-aa86-2740-2610-cad2a1165430;/imovel/aluguel-casa-3-quartos-com-jardim-jose-de-alencar-fortaleza-ce-130m2-id-2628795041/;GRUPOZAP;2628795041;RENTAL;ALL;Fortaleza;VALID_STREET;mês;;2.500;casas;False;False;False;True;False;False;False;False;False;False;False;False;False;False;False;False;False
;MEGA ADMINISTRACAO DE IMOVEIS LTDA - ME;270;270;Casa com 3 quartos para alugar no bairro Parangaba Fortaleza/CE;Casa plana terreo, dispondo de 270m², sala ampla, varanda, cozinha com armários, 3 quartos sendo 1 suíte, 1 banheiro social, área de serviço, quintal amplo e 2 vagas.<br>Localizado próximo a praça da Vila Bethânia, Super São José, Ecoponto, com fácil acesso a Shopping Parangaba, Av. Osorio de Paiva e outras facilidades.<br>Venha conhecer! -;2023-04-08T06:27:18.392Z;2023-05-05T03:04:43.631Z;;2;60740235;Rua Iara;Parangaba;275;1;2;3;;1.862;;STANDARD;HOME;;RESIDENTIAL;KITCHEN|BACKYARD|SERVICE_AREA;-3.777355;RENTAL;Bairros;False;Casa para alugar em;00452-J-CE;1.600;0;-38.558402;False;USED;GOOGLE;UNIT;0;False;CA1267;True;Ceará;ROOFTOP;False;;Alugar;BR;STREET;ad5fe715-fe78-13a9-9ad1-0d1926f4b893;/imovel/aluguel-casa-3-quartos-com-cozinha-parangaba-fortaleza-ce-270m2-id-2624514952/;GRUPOZAP;2624514952;RENTAL;ALL;Fortaleza;VALID_STREET;mês;;1.600;casas;False;False;True;False;False;False;False;False;False;False;False;False;False;False;False;False;False
