;Brasil Corretores Associados;135;135;AG BEZERRA IMÓVEIS www.agbezerra.com.br WhatsApp: ( 8 8 ) 9 9 3 7 6 8586 (Corretor Tibério;"AG BEZERRA IMÓVEIS<br>www.agbezerra.com.br<br><br>WhatsApp: ( 8 8 ) 9 9 3 7 6 8586 (Corretor Tibério Bezerra)<br><br>WhatsApp: ( 8 8 ) 2 1 3 1 8114 (Corretora Dimona Azevedo)<br><br><br>Casas com 135m2 Ampla e Arejada, com:<br>Sala de Estar<br>Sala de Jantar,<br>03 Suítes;<br>Lavabo<br>Cozinha<br>Despensa<br>Área de serviço<br>Dependência de secretária com banheiro;<br>Box em 3 banheiros;<br>Armário na Cozinha;<br>Armário nos Banheiros;<br>Armários nas suítes.<br><br>Condomínio Disponhe De:<br><br>Piscina<br>Espaço fitness<br>Sala de jogos<br>Sauna<br>Espaço zen.<br>Espaço Kids<br>Deck Gourmet<br>Campo de futebol<br><br><br>Agende sua visita!<br><br>WhatsApp: ( 8 8 ) 9 9 3 7 6 8586 (Corretor Tibério Bezerra)<br><br>WhatsApp: ( 8 8 ) 2 1 3 1 8114 (Corretora Dimona Azevedo)<br><br>AG BEZERRA IMÓVEIS<br>CRECI 20187<br><br>www.agbezerra.com.br<br><br>Consulte a disponibilidade.<br><br><br><i>As informações estão sujeitas a alterações. Consulte o corretor responsável.</i><br><br><br>Informações sobre o condomínio<br><br> <br><br><br>Chave do anúncio: STpRAJp1LrpeV151";2023-04-27T15:21:35.018Z;2023-05-02T15:32:40.297Z;;1;63047070;Rua Odilon Figueiredo;Planalto;1455;3;4;3;;;714;STANDARD;HOME;;RESIDENTIAL;POOL|INTERCOM|BARBECUE_GRILL|PLAYGROUND;-7.242423;RENTAL;Bairros;False;Casa para alugar em;;2.700;0;-39.307417;False;USED;GOOGLE;UNIT;0;False;TBA150;True;Ceará;GEOMETRIC_CENTER;False;;Alugar;BR;STREET;dd670833-7d0b-3854-8b2e-62854084ad2c;/imovel/aluguel-casa-3-quartos-com-piscina-planalto-juazeiro-do-norte-ce-135m2-id-2628808974/;GRUPOZAP;2628808974;RENTAL;ALL;Juazeiro do Norte;VALID_STREET;mês;3.414;2.700;casas;True;False;False;False;True;False;False;False;False;False;False;False;False;False;False;True;False
;NOVA ERA CONSULTORIA IMOBILIARIA EIRELI - ME;155;168;Casa com 3 dormitórios para alugar, 155 m² por 1.778,00/mês - Parque Manibura - Fortaleza/CE;Casa Duplex - Parque Manibura<br><br>Excelente localização para quem busca conforte e comodidade para o dia a dia, próximo a Av. Edilson Brasil Soares, Av. Washington Soares, a poucos minutos do Shopping Via Sul, Colégio Ari de Sá, fácil acesso a supermercados, restaurantes, farmácias.<br><br>Terreno medindo 10,50m x 16m, perfazendo uma área total de 168m² e 155,42m de área construída.<br>Piso inferior - 2 salas, cozinha com despensa, área de serviço, dependência completa de empregada, garagem para até 4 carros.<br>Piso superior - 3 quartos sendo 1 suíte com 2 varandas, 1 wc social.<br><br>Agende uma visita com um dos nossos especialistas!<br><br><br><br> -;2023-04-18T02:31:17.664Z;2023-05-01T10:18:06.936Z;;4;60821820;;Parque Manibura;;1;3;3;;78;;STANDARD;HOME;;RESIDENTIAL;KITCHEN|LAUNDRY|BALCONY|SERVICE_AREA;;RENTAL;Bairros;False;Casa para alugar em;01007-J-CE;1.700;0;;False;USED;;UNIT;0;False;CA0099;True;Ceará;ROOFTOP;False;;Alugar;BR;STREET;87f4429d-98f8-9729-db36-cf3e2db221cc;/imovel/aluguel-casa-3-quartos-com-cozinha-parque-manibura-fortaleza-ce-155m2-id-2626731159/;GRUPOZAP;2626731159;RENTAL;NEIGHBORHOOD;Fortaleza;VALID_STREET;mês;;1.700;casas;False;False;False;False;False;False;False;False;False;False;False;False;False;False;False;False;False
;A PREDIAL IMÓVEIS LTDA EPP;140;140;Casa para aluguel, 3 quartos, 3 suítes, 2 vagas, Barroso - Fortaleza/CE;Agora você pode morar nesta maravilhosa casa, a poucos minutos do Centerbox Supermercados<br><br>- sala<br>- cozinha<br>- 02 varandas<br>- 03 quartos sendo 3 suítes<br>- banheiro<br>- área de serviço<br>- quintal <br>- 02 vagas de garagem <br><br>O melhor de tudo é que está localizado próximo ao Esquina do Caranguejo, Opção Distribuidora de Alimentos e Bebidas, UniAteneu, farmácias, unidade de saúde, entre outros. <br><br>Agende uma visita e confira agora mesmo.;2023-01-04T07:40:22.356Z;2023-05-04T12:21:30.128Z;0;2;60863315;Rua Taquatiara;Barroso;740;3;3;3;;73;;STANDARD;HOME;;RESIDENTIAL|COMMERCIAL;BALCONY|GARAGE|KITCHEN|SERVICE_AREA;-3.829226;RENTAL;Bairros;False;Casa para alugar em;00051-J-CE;1.500;0;-38.50765;False;USED;GOOGLE;UNIT;0;False;8028;True;Ceará;ROOFTOP;False;;Alugar;BR;STREET;fc5712e9-fa43-5098-d352-567837858f50;/imovel/aluguel-casa-3-quartos-com-varanda-barroso-fortaleza-ce-140m2-id-2603346055/;GRUPOZAP;2603346055;RENTAL;ALL;Fortaleza;VALID_STREET;mês;;1.500;casas;False;False;False;False;False;False;False;False;False;False;False;False;False;False;False;False;False
;ROSANGELA XAVIER MOURA - ME;120;480;Casa no Icaraí , Próximo ao Supermercado Mar e Sol , á 02 Quarteirões da Praia;"PARA MAIORES INFORMAÇÕES FALE NO WHATSAPP<br> Tim WhatsApp<br> oi <br>CASA DE PRAIA NO ICARAÍ...<br>PRÓXIMO AO SUPERMERCADO MAR E SOL<br>Á 02 QUARTEIRÕES DA PRAIA<br>RUA GEORGE CORREIA NUNES<br>- VAGAS P/ 04 CARROS; <br>- 03 QUARTOS (01 SUÍTES),<br>- 03 BANHEIROS, <br>- SALA ESTAR.<br>- COZINHA AMERICANA.<br>- ÁREA DE SERVIÇO,<br>- DECK COM CHURRASQUEIRA<br>- PISCINA <br>- CAMPO GRAMADO";2023-04-23T18:51:16.215Z;2023-04-23T18:51:21.615Z;;4;61620030;Rua George Correia Nunes;Icarai;1625;1;3;3;;;;STANDARD;HOME;;RESIDENTIAL;RECREATION_AREA|FOOTBALL_FIELD|BARBECUE_GRILL|POOL|NEAR_ACCESS_ROADS|SERVICE_AREA|PRIVATE_POOL|AMERICAN_KITCHEN;-3.668462;RENTAL;Bairros;False;Casa para alugar em;08979-J-CE;2.500;0;-38.677626;False;USED;GOOGLE;UNIT;0;False;PAULO - CASA ICARAÍ - ALUGUEL 2500;True;Ceará;RANGE_INTERPOLATED;False;;Alugar;BR;STREET;277fe3b7-e4e3-8c1d-4c96-72ab280f92c1;/imovel/aluguel-casa-3-quartos-com-piscina-icarai-caucaia-ce-120m2-id-2627965953/;GRUPOZAP;2627965953;RENTAL;ALL;Caucaia;VALID_STREET;mês;;2.500;casas;True;False;False;False;True;False;False;False;False;False;False;False;False;False;False;False;False
;SOL NASCENTE CONSULTORIA E IMOBILIARIA LTDA - ME;120;120;Casa com 3 dormitórios para alugar, 120 m² por 1.239,00/mês - Sapiranga - Fortaleza/CE;Casa térreo, com 3 quartos, sendo 1 suíte, sala de estar, sala de jantar, WC social, cozinha americana, quintal com área de serviço, amplo estacionamento, portão automático e cerca elétrica.<br><br>Imóvel localizado próximo a Washington Soares, com escolas, supermercados e comércio em geral nas imediações.<br><br>Entre em contato e agende sua visita! -;2023-04-13T01:26:35.405Z;2023-05-05T09:00:32.981Z;;2;60833695;;Sapiranga;;1;1;3;;38;1;STANDARD;HOME;;RESIDENTIAL;KITCHEN|INTERCOM|LAUNDRY|BACKYARD|SERVICE_AREA;;RENTAL;Bairros;False;Casa para alugar em;00749-J-CE;1.200;0;;False;USED;;UNIT;0;False;CA1644;True;Ceará;ROOFTOP;False;;Alugar;BR;STREET;c27910a9-7ff5-fbc7-b3a8-8deca3b971d2;/imovel/aluguel-casa-3-quartos-com-cozinha-sapiranga-fortaleza-ce-120m2-id-2625825544/;GRUPOZAP;2625825544;RENTAL;NEIGHBORHOOD;Fortaleza;VALID_STREET;mês;1.201;1.200;casas;False;False;True;False;False;False;False;False;False;False;False;False;False;False;False;False;False
premium;Ícone Empreendimentos Imobiliários;60;;Aluga-se casa com 3 quartos sendo 1 suíte por 1.200,00/mês no Montese - Fortaleza;Casa para alugar na Rua Raul Uchoa, 113 Altos com sala, 3 quartos (1 suíte), WC social, lavanderia, cozinha,<br>Próximo ao Banco do Brasil.;2023-03-21T19:16:49.740Z;2023-03-21T19:17:00.717Z;;;60416510;Rua Raul Uchôa;Montese;113;1;2;3;;;;PREMIUM;HOME;;RESIDENTIAL;;-3.761595;RENTAL;Bairros;False;Casa para alugar em;00702-J-CE;1.200;0;-38.544489;False;USED;GOOGLE;UNIT;0;False;0263;True;Ceará;ROOFTOP;False;;Alugar;BR;STREET;5af25f95-b885-5b38-6714-a88af0d5cadc;/imovel/aluguel-casa-3-quartos-montese-fortaleza-ce-60m2-id-2619971535/;GRUPOZAP;2619971535;RENTAL;ALL;Fortaleza;VALID_STREET;mês;;1.200;casas;False;False;False;False;False;False;False;False;False;False;False;False;False;False;False;False;False
premium;FAX IMOBILIÁRIA;200;200;Casa para aluguel tem 200 metros quadrados com 3 quartos em Cidade dos Funcionários - Fortaleza - CE;A casa no bairro Cidade dos Funcionários possui 200 m2, com 3 quartos, sendo 1 suite e 3 banheiros, 02 vagas, toda forrada e gradeada, ótima localização.<br>Whatsapp nove nove, sessenta, quatro dois, oito oito.;2023-03-03T13:04:54.647Z;2023-05-02T12:01:15.318Z;;2;60822040;Rua General Castelo Branco;Cidade dos Funcionários;120;1;3;3;;;;PREMIUM;HOME;;RESIDENTIAL;PETS_ALLOWED;-3.794035;RENTAL;Bairros;False;Casa para alugar em;;1.450;0;-38.491994;False;USED;GOOGLE;UNIT;0;False;LCFUNCIONARIOS1UBHINO;True;Ceará;ROOFTOP;False;;Alugar;BR;STREET;87f26ab6-e5ef-7460-ae50-b999a79937de;/imovel/aluguel-casa-3-quartos-cidade-dos-funcionarios-fortaleza-ce-200m2-id-2616469064/;GRUPOZAP;2616469064;RENTAL;ALL;Fortaleza;VALID_STREET;mês;;1.450;casas;False;False;False;False;False;False;False;False;False;False;False;False;False;False;False;False;False
;Imobiliária Torres de Melo Neto LTDA;110;110;Casa em condomínio ao lado do motel lamour e a 100 metros das tapioqueiras nova com 3 quartos sendo;Casa em condomínio ao lado do motel lamour e a 100 metros das tapioqueiras nova com 3 quartos sendo 1 suíte, 1 vaga.;2023-04-26T21:14:02.433Z;2023-05-03T21:24:20.148Z;;0;60872060;Rua Pouso Alegre;Messejana;40;1;2;3;;;220;STANDARD;HOME;;RESIDENTIAL;;-3.84676;RENTAL;Bairros;False;Casa para alugar em;01365-J-CE;1.000;0;-38.477319;False;USED;GOOGLE;UNIT;0;False;L1731;True;Ceará;ROOFTOP;False;;Alugar;BR;STREET;c1fee7e4-fa79-f695-7ce8-514a5578ca9d;/imovel/aluguel-casa-3-quartos-messejana-fortaleza-ce-110m2-id-2628655064/;GRUPOZAP;2628655064;RENTAL;ALL;Fortaleza;VALID_STREET;mês;1.220;1.000;casas;False;False;False;False;False;False;False;False;False;False;False;False;False;False;False;False;False
premium;TALENTUS CONSULTORIA E EMP. IMOBILIÁRIOS LTDA.;70;100;Casa com 3 dormitórios para alugar, 70 m² por 1.200,00/mês - Antônio Bezerra - Fortaleza/CE;Casa com 3 quartos, sendo uma suíte, móveis e ar condicionado splint nos quartos, sala ampla, cozinha com despensa, grande área na frente da casa, toda gradeada, área de serviço, banheiros com blindex, entrada com dois portões de alumínio em perfeito estado de conservação, pronto para morar.<br>Imóvel para locação sem nenhuma mobília,<br><br>Rua Cantor Carlos Augusto, nº 48 - Antônio Bezerra<br><br>Aluguel: 1200,00<br>Iptu: 330,00<br><br>Marque sua visita, mais informações Imobiliária Talentvs 85 3244.4040 - WhatsApp 85 99821.4253. -;2023-04-18T06:45:20.756Z;2023-05-05T11:29:52.491Z;;2;60352400;;Antônio Bezerra;;1;2;3;;;;PREMIUM;HOME;;RESIDENTIAL;AIR_CONDITIONING|KITCHEN|INTERCOM|LAUNDRY|HOME_OFFICE|BACKYARD|SERVICE_AREA;;RENTAL;Bairros;False;Casa para alugar em;00490-J-CE;1.200;0;;False;USED;;UNIT;0;False;CA0090;True;Ceará;ROOFTOP;False;;Alugar;BR;STREET;8b8b8292-302d-ab54-88b0-38f62345d802;/imovel/aluguel-casa-3-quartos-com-ar-condicionado-antonio-bezerra-fortaleza-ce-70m2-id-2626773022/;GRUPOZAP;2626773022;RENTAL;NEIGHBORHOOD;Fortaleza;VALID_STREET;mês;;1.200;casas;False;False;True;False;False;False;False;False;False;False;False;False;False;False;False;False;False
;MEGA ADMINISTRACAO DE IMOVEIS LTDA - ME;85;85;Casa com 3 quartos para alugar no São Gerardo - Fortaleza/CE;Dispõe de 80m², sala, cozinha, 3 quartos sendo 1 suíte e 1 com varanda, banheiro social, área de serviço e 1 vaga de garagem.<br>Localizado a 4 quadras da Avenida Bezerra de Menezes, próximo ao Quartel do Batalhão do Raio, Igreja de São Gerardo,Branco do Brasil, Unifanor, com fácil acesso a Hapvida, Colégio Master, Restaurante Fogo Campeiro e outras conveniências.<br>Venha conhecer! -;2023-04-08T06:27:13.039Z;2023-05-05T03:04:35.356Z;;1;60325140;Rua Estefânia Mendes Mota;Sao Gerardo;726;1;2;3;;389;;STANDARD;HOME;;RESIDENTIAL;KITCHEN|SERVICE_AREA;-3.730116;RENTAL;Bairros;False;Casa para alugar em;00452-J-CE;1.100;0;-38.556438;False;USED;GOOGLE;UNIT;0;False;CA1441;True;Ceará;ROOFTOP;False;;Alugar;BR;STREET;ad5fe715-fe78-13a9-9ad1-0d1926f4b893;/imovel/aluguel-casa-3-quartos-com-cozinha-sao-gerardo-fortaleza-ce-85m2-id-2624517383/;GRUPOZAP;2624517383;RENTAL;ALL;Fortaleza;VALID_STREET;mês;;1.100;casas;False;False;False;False;False;False;False;False;False;False;False;False;False;False;False;False;False
;INOV9 EMPREENDIMENTOS IMOBILIARIOS LTDA-ME;100;100;Casa em condomínio fechado;Para você que procura morar em um dos melhores bairros de Fortaleza, chegou a sua oportunidade.<br><br>Casa localizado no bairro maraponga, próximo a avenida Godofredo Maciel, próximo a escolas e farmácias.<br>Uma grande oportunidade para você e sua família.<br><br>AGENDE SUA VISITA COM UM DE NOSSOS ATENDENTES. -;2023-04-08T03:26:11.261Z;2023-04-29T07:21:16.662Z;;1;60711035;Rua Suíça;Maraponga;;1;1;3;;90;;STANDARD;HOME;;RESIDENTIAL;KITCHEN|BACKYARD|SERVICE_AREA;;RENTAL;Bairros;False;Casa para alugar em;12435-J-CE;1.300;0;;False;USED;;UNIT;0;False;CA1766;True;Ceará;ROOFTOP;False;;Alugar;BR;STREET;0ca8e785-bbdd-c37f-d689-6c788aba2ec1;/imovel/aluguel-casa-3-quartos-com-cozinha-maraponga-fortaleza-ce-100m2-id-2624428780/;GRUPOZAP;2624428780;RENTAL;STREET;Fortaleza;VALID_STREET;mês;;1.300;casas;False;False;True;False;False;False;False;False;False;False;False;False;False;False;False;False;False
;MEGA ADMINISTRACAO DE IMOVEIS LTDA - ME;65;65;Casa com 3 quartos para alugar no São Gerardo - Fortaleza/CE;Dispõe de 65m², sala de estar, cozinha, varanda, 3 quartos, 2 banheiros sociais, lavanderia e 1 vaga na garagem.<br>Localizado a 4 quadras da Avenida Bezerra de Menezes, próximo ao Quartel do Batalhão do Raio, Igreja de São Gerardo,Branco do Brasil, Unifanor, com fácil acesso a Hapvida, Colégio Master, Restaurante Fogo Campeiro e outras conveniências.<br>Venha conhecer! -;2023-04-05T06:00:45.896Z;2023-04-05T06:00:47.491Z;;1;60325140;Rua Estefânia Mendes Mota;Sao Gerardo;726;0;2;3;;458;;STANDARD;HOME;;RESIDENTIAL;KITCHEN|LAUNDRY;-3.730116;RENTAL;Bairros;False;Casa para alugar em;00452-J-CE;1.000;0;-38.556438;False;USED;GOOGLE;UNIT;0;False;CA1442;True;Ceará;ROOFTOP;False;;Alugar;BR;STREET;ad5fe715-fe78-13a9-9ad1-0d1926f4b893;/imovel/aluguel-casa-3-quartos-com-cozinha-sao-gerardo-fortaleza-ce-65m2-id-2623025750/;GRUPOZAP;2623025750;RENTAL;ALL;Fortaleza;VALID_STREET;mês;;1.000;casas;False;False;False;False;False;False;False;False;False;False;False;False;False;False;False;False;False
premium;INOV9 EMPREENDIMENTOS IMOBILIARIOS LTDA-ME;200;200;Casa com 3 dormitórios para alugar por 2.090,00/mês - Mondubim - Fortaleza/CE;Casa com 3 dormitórios para alugar por 2.090/mês - Mondubim - Fortaleza/CE -;2023-04-08T03:26:09.170Z;2023-05-05T07:35:42.384Z;;3;60762593;Rua C;Mondubim;;2;1;3;;90;;PREMIUM;HOME;;RESIDENTIAL;KITCHEN|BACKYARD|SERVICE_AREA;;RENTAL;Bairros;False;Casa para alugar em;12435-J-CE;2.000;0;;False;USED;;UNIT;0;False;CA1731;True;Ceará;ROOFTOP;False;;Alugar;BR;STREET;0ca8e785-bbdd-c37f-d689-6c788aba2ec1;/imovel/aluguel-casa-3-quartos-com-cozinha-mondubim-fortaleza-ce-200m2-id-2624433553/;GRUPOZAP;2624433553;RENTAL;STREET;Fortaleza;VALID_STREET;mês;;2.000;casas;False;False;True;False;False;False;False;False;False;False;False;False;False;False;False;False;False
;SJ IMOVEIS;120;120;BARBALHA - Casa Padrão - BULANDEIRA;Casa com boa localização, próximo a avenida leão Sampaio, Distribuidora de alimentos Donizete, Madeireira FG, Ciprol Caminhões Ford, Espaço Luz Buffet, Ponto da Panelada, Churrascaria Cupim na Brasa e indústria de calçados Kinccal. Casa com garagem pra 2 carros, sala, cozinha, suíte, 2 quartos, banheiro social, area de serviço, quintal com bia. Venha conhecer a casa, ligue e agende sua visita!;2023-02-16T12:13:27.170Z;2023-05-05T09:54:37.456Z;;2;63180000;;Bulandeira;;1;1;3;;;;STANDARD;HOME;;RESIDENTIAL;NUMBER_OF_FLOORS|AIR_CONDITIONING|BACKYARD|SERVICE_AREA;;RENTAL;Bairros;False;Casa para alugar em;00350-J-CE;1.000;0;;False;USED;;UNIT;0;False;52932;True;Ceará;RANGE_INTERPOLATED;False;;Alugar;BR;STREET;f060bc0a-ee24-9158-a856-e878deddd620;/imovel/aluguel-casa-3-quartos-bulandeira-barbalha-ce-120m2-id-2613169822/;GRUPOZAP;2613169822;RENTAL;NEIGHBORHOOD;Barbalha;VALID_STREET;mês;;1.000;casas;False;False;True;False;False;False;False;False;False;False;False;False;False;False;False;False;False
rankingSuperPremium;Imobiliária Luiz Rêgo;98;98;CA964 - Aluga casa na Castelão com 3 quartos sendo 2 suítes, e 1 vaga.;CA964 - Imobiliária Luiz Rêgo aluga casa no Castelão, com:<br><br>varanda / sala dois ambientes / 3 quartos ( 2 suítes- sendo 1 reversível) /cozinha / banheiro social /área de serviço / quintal / 1 vaga / cerca elétrica / portão automático.<br><br>Seguro incêndio: 239,19 (anual)<br><br>Taxa do lixo: 268,17 (anual)<br><br>Alugamos com fiador ou caução. -;2023-04-08T22:06:41.534Z;2023-05-05T02:52:29.140Z;;1;60867530;Rua Maestro Néo Miranda;Castelão;237;2;2;3;;469;;SUPER_PREMIUM;HOME;;RESIDENTIAL;KITCHEN|BACKYARD|SERVICE_AREA;-3.801987;RENTAL;Bairros;False;Casa para alugar em;00458-J-CE;1.500;0;-38.518259;False;USED;GOOGLE;UNIT;0;False;CA0036;True;Ceará;ROOFTOP;False;;Alugar;BR;STREET;e611d648-5cc3-05d3-1e6e-79b428e8c31e;/imovel/aluguel-casa-3-quartos-com-cozinha-castelao-fortaleza-ce-98m2-id-2624757529/;GRUPOZAP;2624757529;RENTAL;ALL;Fortaleza;VALID_STREET;mês;;1.500;casas;False;False;True;False;False;False;False;False;False;False;False;False;False;False;False;False;False
premium;Mota da Costa Administração de Imóveis Ltda ME;90;90;CASA NA SERRINHA;Casa com 01 quarto + 01 suite, sala, cozinha, wc social, area de serviço, lavaderia, dependencia e garagem.<br><br>Agua e luz individuais.<br><br>IPTU isento.<br><br>*Valor sujeito a alteração sem aviso prévio!;2023-04-01T15:15:15.300Z;2023-04-22T05:49:32.639Z;;0;60741600;Avenida Bernardo Manuel;Serrinha;7168;1;3;3;;;;PREMIUM;HOME;;RESIDENTIAL;;-3.780423;RENTAL;Bairros;False;Casa para alugar em;00976-J-CE;1.300;0;-38.545978;False;USED;GOOGLE;UNIT;0;False;L771;True;Ceará;ROOFTOP;False;;Alugar;BR;STREET;d900aed9-95c5-2794-de77-266b9affb663;/imovel/aluguel-casa-3-quartos-serrinha-fortaleza-ce-90m2-id-2622279861/;GRUPOZAP;2622279861;RENTAL;ALL;Fortaleza;VALID_STREET;mês;;1.300;casas;False;False;False;False;False;False;False;False;False;False;False;False;False;False;False;False;False
superPremium;Imobiliária Luiz Rêgo;98;98;CA964 - Aluga casa na Castelão com 3 quartos sendo 2 suítes, e 1 vaga.;CA964 - Imobiliária Luiz Rêgo aluga casa no Castelão, com:<br><br>varanda / sala dois ambientes / 3 quartos ( 2 suítes- sendo 1 reversível) /cozinha / banheiro social /área de serviço / quintal / 1 vaga / cerca elétrica / portão automático.<br><br>Seguro incêndio: 239,19 (anual)<br><br>Taxa do lixo: 268,17 (anual)<br><br>Alugamos com fiador ou caução. -;2023-04-08T22:06:41.534Z;2023-05-05T02:52:29.140Z;;1;60867530;Rua Maestro Néo Miranda;Castelão;237;2;2;3;;469;;SUPER_PREMIUM;HOME;;RESIDENTIAL;KITCHEN|BACKYARD|SERVICE_AREA;-3.801987;RENTAL;Bairros;False;Casa para alugar em;00458-J-CE;1.500;0;-38.518259;False;USED;GOOGLE;UNIT;0;False;CA0036;True;Ceará;ROOFTOP;False;;Alugar;BR;STREET;e611d648-5cc3-05d3-1e6e-79b428e8c31e;/imovel/aluguel-casa-3-quartos-com-cozinha-castelao-fortaleza-ce-98m2-id-2624757529/;GRUPOZAP;2624757529;RENTAL;ALL;Fortaleza;VALID_STREET;mês;;1.500;casas;False;False;True;False;False;False;False;False;False;False;False;False;False;False;False;False;False
superPremium;MEGA VENDA DE IMOVEIS,SERVIÇOS E CONDOMINIO LTDA;210;228;Casa com 3 dormitórios para alugar, 209 m² por 2.400,00/ano - São Bento - Fortaleza/CE;Localizado a 3 quadras da Av. Edson Magalhães, próximo ao Estádio Moreirão, Colégio Joaquim Barroso Neto, Nova Fitness Academia, Farmácia Droga Life, com fácil acesso a Av. Dr. Mendel Steinbruch, Banco Santander e outras conveniências.<br>Casa duplex dispõe de 130 m², sala ampla, cozinha, 3 suíte, closet, varanda, banheiro social, área de serviço, deck com churrasqueira e 3 vagas de garagem.<br>Venha conhecer! -;2022-06-24T08:34:38.447Z;2023-05-03T03:38:46.023Z;;3;60875600;;São Bento;;3;4;3;;;;SUPER_PREMIUM;HOME;;RESIDENTIAL;BARBECUE_GRILL|KITCHEN|BACKYARD|SERVICE_AREA;;RENTAL;Bairros;False;Casa para alugar em;;2.400;0;;False;USED;;UNIT;0;False;CA0927;True;Ceará;RANGE_INTERPOLATED;False;;Alugar;BR;STREET;d799ba7e-10ff-931b-817a-f11141492529;/imovel/aluguel-casa-3-quartos-com-churrasqueira-sao-bento-fortaleza-ce-210m2-id-2568649910/;GRUPOZAP;2568649910;RENTAL;NEIGHBORHOOD;Fortaleza;VALID_STREET;mês;;2.400;casas;False;False;True;False;True;False;False;False;False;False;False;False;False;False;False;False;False
superPremium;ALMEIDA & ABREU IMOBILIÁRIA;141;141;Casa comercial com faturamento alto no São João do Tauape!!;Casa comercial com faturamento alto no São João do Tauape!!!<br>Salão principal, 02 banheiro social, 2 cômodos e 1 cozinha.;2022-05-20T08:39:13.132Z;2023-02-25T02:47:51.759Z;;0;60130370;Rua Monsenhor Salazar;Tauape;689;0;3;3;;;;SUPER_PREMIUM;HOME;;RESIDENTIAL;;-3.755992;RENTAL;Bairros;False;Casa para alugar em;10461-J-CE;2.100;0;-38.513655;False;USED;GOOGLE;UNIT;0;False;L543;True;Ceará;ROOFTOP;False;;Alugar;BR;STREET;40cc44ac-70ed-1a2d-c64f-ba8e6c36b17a;/imovel/aluguel-casa-3-quartos-tauape-fortaleza-ce-141m2-id-2563554688/;GRUPOZAP;2563554688;RENTAL;ALL;Fortaleza;VALID_STREET;mês;;2.100;casas;False;False;False;False;False;False;False;False;False;False;False;False;False;False;False;False;False
;HS OPERAÇÕES IMOBILIARIAS LTDA - ME;80;;Alugo excelente casa Rua Pe. Guerra,80m2, Parque Araxá;Alugo excelente casa plana na Rua Pe. Guerra, 163, Altos, Bairro Parquelândia, com 80m2 de área, sala de estar/jantar, 2 quartos sociais, 2 banheiros, cozinha, área de serviço, quarto de serviço. Casa segura, toda pintada, ótima localização, rua tranquila, próximo da Av. Jovita Feitosa, supermercados, escolas, farmácias e hospitais. Para visitas agendar pelo chat ou enviar mensagem por whatsapp (85) 98605.0031/99982.7720, HS IMÓVEIS.;2023-01-27T15:53:26.498Z;2023-01-31T12:33:47.446Z;;;60450665;Rua Padre Guerra;Parque Araxá;163;;2;3;;73;;STANDARD;HOME;;RESIDENTIAL;PETS_ALLOWED;-3.736592;RENTAL;Bairros;False;Casa para alugar em;01014-J-CE;1.000;0;-38.545408;False;USED;GOOGLE;UNIT;0;False;4KCVN3;True;Ceará;ROOFTOP;False;;Alugar;BR;STREET;c263a818-91f4-8cda-8aa5-eb7ea906ea76;/imovel/aluguel-casa-3-quartos-parque-araxa-fortaleza-ce-80m2-id-2608817774/;GRUPOZAP;2608817774;RENTAL;ALL;Fortaleza;VALID_STREET;mês;;1.000;casas;False;False;False;False;False;False;False;False;False;False;False;False;False;False;False;False;False
;A PREDIAL IMÓVEIS LTDA EPP;150;150;Casa para aluguel, 3 quartos, 1 suíte, 1 vaga, Henrique Jorge - Fortaleza/CE;Agora você pode morar nesta bela casa, próximo a Av. Senador Fernandes Távora. <br><br>- sala<br>- cozinha<br>- 03 quartos ( sendo 01 suíte)<br>- banheiro<br>- área de serviço<br>- quintal<br><br>Não perca a oportunidade de está localizado próximo a restaurantes, rede de ensino, unidade de saúde, supermercados, entre outros. <br><br>Agende uma visita e confira agora mesmo.;2023-04-27T12:06:34.576Z;2023-05-05T12:25:33.306Z;0;1;60510192;Rua Guarani;Henrique Jorge;;1;2;3;;;;STANDARD;HOME;;RESIDENTIAL;GARAGE|KITCHEN|BACKYARD|SERVICE_AREA;;RENTAL;Bairros;False;Casa para alugar em;00051-J-CE;1.200;0;;False;USED;;UNIT;0;False;7462;True;Ceará;ROOFTOP;False;;Alugar;BR;STREET;fc5712e9-fa43-5098-d352-567837858f50;/imovel/aluguel-casa-3-quartos-henrique-jorge-fortaleza-ce-150m2-id-2628774185/;GRUPOZAP;2628774185;RENTAL;STREET;Fortaleza;VALID_STREET;mês;;1.200;casas;False;False;True;False;False;False;False;False;False;False;False;False;False;False;False;False;False
;EDSON ALVES BORBA JUNIOR;65;150;Casa para aluguel com 65 metros quadrados com 3 quartos na Smart City Aquiraz - Aquiraz - CE;A casa está localizado na Smart City Aquiraz com 65 metros quadrados com 3 quartos sendo 1 suite e 2 banheiros. <br><br>Possui , espaço jardinado, parquinho infantil.<br>Vai lhe possibilitar praticar diversos esportes na quadra poliesportiva.Espaço para preparar o seu churrasco.;2022-12-15T13:41:50.045Z;2023-03-28T14:28:04.899Z;;2;61700000;;Patacas;36;1;2;3;;100;;STANDARD;HOME;;RESIDENTIAL;BARBECUE_GRILL|CINEMA|GOURMET_SPACE|GARDEN|PLAYGROUND|SPORTS_COURT|COWORKING|BICYCLES_PLACE;-3.982376;RENTAL;Bairros;False;Casa para alugar em;10124-F-RN;1.250;0;-38.367933;False;USED;GOOGLE;UNIT;0;False;1RSOORG;True;Ceará;APPROXIMATE;False;;Alugar;BR;NEIGHBORHOOD;a00835e4-d680-8790-de41-5766aa7212cc;/imovel/aluguel-casa-3-quartos-com-churrasqueira-patacas-aquiraz-ce-65m2-id-2599652886/;GRUPOZAP;2599652886;RENTAL;ALL;Aquiraz;VALID_STREET;mês;;1.250;casas;False;False;False;True;True;False;False;True;False;False;False;False;False;False;False;True;False
;FZ IMOVEIS LTDA. - EPP;172;433;CASA para aluguel, 3 quartos, 1 suíte, 5 vagas, Vila União - FORTALEZA/CE;Casa residencial nascente, com 432m² de área total, sendo 171m² de área construída, piso em cerâmica/tacos, varanda, sala (estar/jantar), 03 quartos, sendo 01 suíte, gabinete duplo, WC social e serviço, dependência simples de empregada, cozinha, área de serviço, quintal, cerca elétrica e grades. Armários nos quartos, suíte, WC'S e cozinha e 05 vagas na garagem.fzimoveis, aluguel, queroalugar, imobiliária, Escritório, apartamento, casa, alugueldeimoveis;2023-03-01T02:15:25.794Z;2023-05-05T03:05:32.749Z;0;5;60410722;Rua Moreira Gomes;Vila União;460;1;3;3;;1.016;;STANDARD;HOME;;RESIDENTIAL;BALCONY|GARAGE|KITCHEN|HOME_OFFICE|SERVICE_AREA;-3.762111;RENTAL;Bairros;False;Casa para alugar em;00257-J-CE;2.000;0;-38.534522;False;USED;GOOGLE;UNIT;0;False;61;True;Ceará;ROOFTOP;False;;Alugar;BR;STREET;d3494078-90ae-b335-737d-026ac10304e5;/imovel/aluguel-casa-3-quartos-com-varanda-vila-uniao-fortaleza-ce-172m2-id-2615796999/;GRUPOZAP;2615796999;RENTAL;ALL;Fortaleza;VALID_STREET;mês;;2.000;casas;False;False;False;False;False;False;False;False;False;False;False;False;False;False;False;False;False
